dialect	standard
어르신 이 마 이 마으레 대해서 쫌 이야기를 해 주십씨요	어르신 이 마을이 마을에 대해서 좀 이야기를 해 주십시오
이 마으리 언제 형성이 데어꼬 어떠케 형성이 데에꼬 그 다음메주로어떤 성씨드리 사시는지 이 마을 유래에 대해서 함 번	이 마을이 언제 형성이 되었고 어떻게 형성이 되었고 그 다음에주로 어떤 성씨들이 사시는지 이 마을유래에 대해서 한 번
삼뱅 년 저니이께네아 지금부터 그몀 면 녀이롱 이천시빌 려네 삼뱅 녀느얼빼먼 데잔냐	삼백 년 전이니까 지금부터 그러면 몇 년이냐 이천십일 년에서 삼백년을 빼면 되잖아
한 은 삼뱅 년 삼뱅 년 전도 이퍙은 한 삼뱅 년 정거 데께려 동네게 생에에헤 여어께 에헥 그르코 여 동네 사는 사람드런 추 주로 인제 으성 깅가드리 여게 인제 우 와 가주고 이 이퍙한 제가 삼뱅 녀이라 그능 게고요	한 어삼백 년 삼백 년 정도 입향은 한 삼백 년 정도 될거야 동네가 생긴여기가어 그렇고 여기 동네 사는 사람들은 주 주로 인제 의성 김가들이 여기에 이제 와와 가지고 입향 입향한 지가 삼백 년이라 그러는 것이고요
그아문 지굼 한 삼배 이퍙한 지가 한 삼뱅 년 데션는데 그암며너 처음 이마으레 인제 의성 김씨 하라버지께서 이리로 오셔쓸 꺼 아님미까	그러면 지금한 삼백 입향한 지가 한 삼백 년 되셨는데 그러면은 처음 이 마을에 인제 의성 김씨 할아버지께서 이리로 오셨을 것 아닙니까
이퍙하실 때 어어 어디서 오션는지 혹씨 아심미까	입향하실 때어디에서 오셨는지 혹시 아십니까
크게 상주서 와쩨	그게 상주에서 왔지
상주 상주서 그어 상주서 그르익 개암 할배미 여어 처뻔 두오시찌 안나	상주 상주에서 거기 상주에서 그러니 개암 할아버지께서 여기에 첫 번째로 들어오셨지 않나
후래 그엄믄 저으아 저게 저 어르이 파론 할배밈 미리 오시꾸나	후야그러면 저 저기 저 어른이 팔오헌이며 년에 개암선생의 현세손으로 태어나서 년에 운명했다 자는 덕휴이며 호가 팔오헌이며 벼슬은 부제학에 이르렀다 자연부락 이름이 바래미인 이 마을을 개척한 인물이  다 할아버지께서 미리 오셨구나
그으또 아이고 그믄 누구로	어 그것도 아니고 그러면 누구냐
그업 그 어느 하럴버이 어느 할배라고예	그 그 어느 할아버지 어느 할아버지라고요
개암	개암
개아암 호를 호를 익	아 개암호를 호를 이제
개암 할뱀	개암 할아버지
개 짜 암 짜 이르케	개 자 암 자 이렇게
예 예아	예예
암개 짜르 므승 개 짜를 써씀미거	암개 자는 무슨 개 자를 썼습니까
거릉 개 짜	시내 계 자
아 에 그렁 거 그렁 게 짜 바이 암 짜	아예 시내 시 시내 계자 바위 암 자
바우 암 짜	바위 암 자
개암	개암
개암 스생님께서 인제 이리로 처음 이퍙하션는지 앙 그아믄 더 위때 오션는지느 정화카진 안치마넌	개암 선생님께서 인제 이리로 처음 입향하셨는지 안 그러면 더 윗대에서 오셨는지는 정확하지는 않지만은
어역 정왁 찬체이으그	예 정확하지 않지요
고 고 다으메능 꼬어 파로언 할뱀 안 아임 두 분 중에 드옹 그넌 아매 미리옹 거는 개암 할배미 미리 옹 거 거튼데 그걸러	그 그 다음에는 그팔오헌할아버지 아니면 아니면 두 분 중에 들어온 것은 아마 미리 온 것은 계암 할아버지께서 미리 오신 것 같은데 그것을
그래서 이퍙하러 이퍙하신 어르신께스너 어째뜬 개암 하라버지시나 어이거나 앙 그러며넘 파론 하라버지 두우 뿐 중에 함 부니시다 그제	그래서 입향하러 입향하신 어르신께서는 어쨌든 개암 할아버지이시거나 아니거나 안 그러면은 팔오헌 할아버지 두 분 중에 한 분이시다 그렇지요
예에	예
파 어더익 그업 개암 하라브지에 대해서 함분 마 어이 아시는 데로 함번 이야기해 주실 쑤 이씀미까	팔 어떻게 그 개암 할아버지에 대해서 한 번 말아시는 대로 한 번 이야기해 주실 수 있습니까
인지 개암 선생이음선조가 여게	예 인제 개암 선생님께서선조가 여기에
열 개 짜에다가바이 암 짜임	열 개 자에다가바위 암 자입니까
아이 아이래여 이 양바안 겨 마자이 열 개 짜래 열 개 짜이와 바우 암 짜래	아니 아니에요 이 양반 그래 맞아요 열 개 자야 열 개 자에 바위 암자야
열 개 짜 바으 만 짜고	열 개 자 바위 암 자고
그레 이 양바니 여게 인데	그래 이 양반이 여게 인제
개암 그아므 개암 쓰앵님께서 인제 일로 오 이퍙을 하실꺼나 앙 그암파론 쓰앵님 하싱 검미까	예 개암 그러면 개암 선생님께서 인제 이리로 오셔서입향을 하셨거나 안 그러면 팔오헌 선생님께서 하신 겁니까
이퍙 에 응 선조넘 파롼 선조고요 에 개암공은 그르 인제 에 이 끼 개암공어 현소니에 이 양바니	입향 선조는 에팔오헌 선조고요 에 개암공은 그래인제 이 그 개암공의 현손이야 이 양반이
파루오니	팔오헌이
기 에 개암 할배므유 현소니 파로언 선새인데 거어서 여어겐 인젱 이퍙 선조로 데 인네 여가	개개암 할아버지의 현손이 팔오헌 선생인데 거기에서 여기가 인제입향 선조로 되어 있네 여기가
이퍙 선조로 데 이꼬	입향 선조로 되어 있고
파로언 스애임께서 인제 스애잉께서 이리로 입 이퍙을 하셔 가주고 지웅 그암며너 여기에입	팔오헌 선생님께서 인제 선생님께서 이리로 입향 입향을 하셔 가지고 지금 그러면은 여기에입향
예예 예	예예예 예
그르이 파로오느니 인제 으이 개아므 현소니고 휘 짜는 선 짜 구 짜라 구누여 이그 그 파로옴뿐 아이래 에 에뜨 그 저 휘는 소리 성 짜 고리 구 짜라꼬데에스 성구라꼬 데 이써에 곤	그러니 팔오헌이 인제개암의 현손이고 휘 자는 성 자 구 자라고 그러고 이것 그 팔오헌 뿐만 아니라어 그 저 휘는소리 성 자 오랠 구자라고 되어서 성구라고 되어 있어여 고것은
소리 성 짜	소리 성 자
바로옹파로	팔오헌팔오헌
소리 성 짜 무승 구 짜예	소리 성 자 무슨 구 자인가요
옹 오리 구 짜용	옛 오랠 구 자요
오래 구 짜	아 오랠 구 자
으야 야 오 오리 오리 구 짜요	예오랠 오랠 오랠 구 자요
파로어는 호고 이 여느 인제흐 휘 짜는 성 짜 구 짜시고 그 호가파러오이구 그래요	팔오헌은 호고 이 여기는 인제휘 휘 자는 성 자 구 자이시고 그 호가 팔오헌이고 그래요
지금 그럼며너 인제 파러온 스애잉께서 은자 이 마을 이 마을 이르미 바래밈미까 해즈	지금 그러면은 인제 팔오헌 선생님께서 인제 이 마을 이 마을 이름이 바래미입니까 해저리
바라미 에 이 그 바라미	바라미 에 이 그 바라미
바 에 짐며	바라미 에 지명
옌날 치명으로는 속칭 브르기는 바라미라 그고 또 여우 관명으로는 관청에서 부릉 언 해저리라 그고	옛날 지명으로는 속칭 부르기는 바라미라 그러고 또여기 관명으로는 관청에서 부르는 것은 해저리라 그러고
해저리예	해저리요
바다 해 짜 저 저어 짜	바다 해 자 밑 저 자
그르이 그래 부르니더	그러니 그래 부릅니다
거며 인제 업 파로언 스애잉께서 은제 여기 이퍄을 하셔 가지고한 삼뱅 년쯔은 야 삼뱅 년 저네 이퍙을 하셔 가주곧 의성 인저 김씨 김문들리 인제집썽촌임미까	그러면 인제 팔오헌 선생님께서 인제 여기 입향을 하셔 가지고 어한 삼백 년쯤 약 삼백 년 전에 입향을 하셔 가지고 의성 인제 김씨 김씨문들이 인제 집성촌입니까
그러치 이퍙하셔찌	그렇지 입향하셨지
메이 집성초니지 그케요	예 집성촌이지 그러게요
지궁 그럼며너 여기에 그거 사시늠 분드너 의성 김씨들 웨에는 다름 분드러업씀미까	지금 그러면은 여기에 그것 사시는 분들은 의성 김씨들 외에는 다른 분들은 없습니까
웨요 이찌용	왜요 있지요
마네여 인지 저거 이 지 옌나레는	많아요 인제 저것 이 저 옛날에는
지 지금믕 그 당시는 쪼꿈 저끼 사럳찓 지그므롭 바서는 우성 깅가들보다타성에어 어응 으 더 만타끄 바에 시방은뇨	지금 지금은 그 당시는 조금 적게살았지 지금으로 봐서는 의성 김가들보다 타성이으 더 많다고 봐요 시방은요
우리 깅가드른 모도 대구 부산 서울 마이 나가 사고 근데 현제 여읻 쩌이집뜨러 거 크 큰 집뜨른 깅가드리 즈 이에이 지비라 할 쩨라등 나미 사는 지비더 마네 시방용	우리 김가들은 모두 대구 부산 서울 많이 나가서 살고 그런데현재 여기 저 집들은 그 큰 큰 집들은 김가들이 저 이 집이라 할 지라도 남이 사는집이 더 많아요 시방은요
실쩨이 그래 데 이꼬요 거우 머 우우 구 지비 비 이씨께 남 주고 사고	실제로는 그래 돼 있고요 그 뭐그 집이 비어 있으니까 남에게 주고 살고
끄래 현제로 바서는 여 한 배 칸 이시 포저 이 저네 반는데 요샌 에읍백이시 포도 쪼끄머 이기 이 여리요	그래 현재로 봐서는 여기 한 백 한 이십 호 어저 이 전에는 봤는데 요새는백이십 호도 조금 이게 이 여려요
배기시 포도 여린 내에서 우 깅으 우릭 깅가들 사능 게 오시비 안 데 께래용	백이십 호도 여기 내에서 우리 김가 우리 김가들 사는 게 오십이 안 될 거에요
한 사십 정도 보고 저 사암들 한은 한 오시 폰 게음 마즈 꺼 테이 지그므로바 가주언녀	한 사십 정도 보고 저 사람들 한 한 오십 호 보면 맞을 것 같아요지금으로 봐 가지고는요
사는 호수 수짜로 바 가즈어넌	사는 호수 숫자로 봐 가지고는
끄엄며는 지금 어째뜬 처음 이프 이 마을 시작뗑 그너 아까 파로언 스애앵께서 먼저 어여 의성김무네서 인제 파로언 스애앵께서 이 마으를 개처글 하셔꼬 그 다으메 집성초느로 쭝 뉴지데다가 이제 타성바지들도 께 드롸 가지우 산다 그지예	그러면은 지금 어쨌든 처음 입향 이 마을이 시작된 것은 아까 팔오헌선생님께서 먼저 의성 의성김씨문에서 인제 팔오헌 선생님께서 이 마을을 개척을 하셨고 그다음에 집성촌으로 쭉 유지되다가 이제 타성바지들도 꽤 들어와 가지고산다 그렇지요
끄르서 그러믄 찌굼 한 타성바지드른 주로 어떤 사암들 머 그 머 드롸가 이씀미까	그래서 그러면 지금 한 타성바지들은 주로 어떤 사람들 뭐 그 뭐 들어와서 있습니까
각성이든 찌웅 각성이래 이에읻 지금 바서너 농사지은 타성들또 농사진는사라민 한 메 단 데곧 주버 인데 머 장터어 가서 장사도 하고 운전도 하는 사람들 먿 주로 인제 그래에 사고 이찌 머에 지금 바서는	각성이든 지금 각성이야 이 지금 봐서는 농사짓는 타성들도 농사짓는 사람은 한 몇 안 되고 주로 인제뭐 장터에 가서 장사도 하고 운전도 하는 사람들 뭐 주로 인제 그래 살고 있지 뭐요 지금 봐서는
으베서 가까우니까웨지으 타성바지드리 드롸서 마니 산다 그지에	아 읍에서 가까우니까외지의 타성바지들이 들어와서 많이 산다 그렇지요
그러면 지금 인저으 어르싱 그엄며너 이 한 해방 전후나 이때엔 쯔엄메넌 해방 저누나 유기오 전후 때는 여기 집성처 집 완전 집성초니여씀미까	그러면 지금 인제 어르신 그러면은 이 한 해방 전후나 이때쯤에는 해방 전후나 육이오 전후때는 여기 집성촌 집성 완전 집성촌이었습까
글때능 끄어 거이가 멛 칩 메 찝 써께 사라찌히	그때는 거기 거의가 몇집 몇 집 섞여 살았지
타성드리 사러도 주루 깅가드리 마이 사러쩨요	타성들이 살아도 주로 김가들이 많이 살았지요
유기오 사변 전후 해 가지오넌	육이오 사변 전후를 해 가지고는
그럼며너 어째뜬 지금머 타성바지드리 제범 마니 사는 그런 마으리다 그지예	그러면은 어쨌든 지금은 타성바지들이 제법 많이 사는 그런 마을이다 그렇지요
그러쳐 마자 마이 사능 마이 살제 그으거	그렇지요 맞아요 많이 사는 많이살지 그것
어째뜨 그래도 머 어째뜬 요즘 다른 마으레 비해스너의성 김씨드리 마니 모이서 사는 집성초니라 할 순 읻슬 정도로 마니 사시능 그 까씀미다	어쨌든그래도 뭐 어쨌든 요즘 다른 마을에 비해서는의성 김씨들이 많이 오여서 사는 집성촌이라 할 수 있을 정도로 많이 사시는 것 같습니다
그르체요 응 그르체머 타동네 대믄 마이 사제	그렇지요 응 그렇지음 뭐 타동네 대면 많이 살지
어르싱 그럼며넌 이 마을 이르메 대해서 함분 머 아시는 대로 혹시 함분 이야기해 주실 쑤 이쓰므 이야기해 주십씨오	어르신 그러면은 이 마을 이름에 대해서 한 번 뭐 아시는 대로 혹시 한 번 이야기해 주실 수 있으면 이야기해 주십시오
웨 받 웨 바라미가 데엔지 또넙 머 해저가 데엔지 그거 함번 이야기해 주실 수 이쓰미 함분 아시는 대로 함번	왜 바라미 왜 바라미가 되었는지 또는뭐 해저리가 되었는지 그것을 한 번 이야기해 주실 수 있으면 한 번 아시는 대로한 번
그게 설명하기가안 난흐 어리푼시 드릉 게 떼 가주 마리야 퍽 에룹뜨라꼬	그게 설명하기가 나는 어렴풋이 들은 것이 돼 가지고 말이야 퍽 어렵더라고
옌나레 여어가 머 바라미라 그능 게 마리제아 그으 은네 게 효 확씰 차네도옌나레 어데 여그 멉파라라 그러 가주고 머 파라 미치 머 뻥어바라미라그르따 소리도 나안데 므 파라라 그능 걸 어델 가주오 파라라 그능 거	옛날에여기가 뭐 바라미라 그러는 게 말이지요 그그 확 확실하지 않아도 옛날에 어디 여기 뭐용두레라그래 가지고 뭐 용두레 밑이 뭐어 바라미라 그랬다는 소리도 나왔는데 뭐 용두레라 그러는 것을 어디를 가지고 용두레라 그런 것인지
파래 미치는 파래 미츠넌 바다 미치이께네 바라미라 그러꼬 그래 지인느 꺼 테요	아 파도 밑은 파도 밑은 바다 밑이니까 바라미라 그랬고 그래 지었는 것 같아요
끄 바 바다 해 짜 해서 머 바다 해 짜 하고 저 엄 미 쩌 짜 써 가주	그 바다 바다 해 자 해서 뭐 바다 해 자 하고 저밑 저 자 써 가지고
미 쩌 짜해저다 그래여	밑 저 자해저리다 그래요
파다그 멈미까	파다가 무엇입니까
저 무럴 이래 대에 노코옴 무리 이비 이쓰먼 여게 무로 우로 퍼 올리능 게래	저 물을 이래 대 놓고 물이 있 있으면 여기에 물을 위로 퍼 올리는 거야
이그래 퍼 올리 가주아이그 그걸	이래 퍼 올려 가지고 그것을
보 퍼 올레 물 푸어능 기구	보 퍼 올려 물 퍼는 기구
므 엉 그 마자 그으래여	뭐그 맞아 그거에요
물 펴능 기구 마자 빠아 파라아 그애능 게	물 퍼는 기구 맞아 용두레 용두레라 그러는 게
그엄머 그게 그업 몸미 물 푸능 기구 그읍 파닥 그어는 마언등 게 오래뒈에씀미까	그러면 그게 그 뭡니까 물 퍼는 기구 그 용두레 그것은 만든 게 오래됐습니까
이 예저 이 이 그래 매엄	어 이 예전 이 이 그렇게 만든
오래데찌 거게엄	오래됐지 그것이
여게 그게 나온다 여 파로온 하파로온 할배미 여게 마리지 이퍙한지가 언제냐 하게 데먼 에 이 경진년 천칠뱅 녀네 여게 동리임 이퍙을 하시꾸만 녀게	아 여기에 그게 나온다 여기 팔오헌 할아버지팔오헌 할아버지께서 여기에 말이지 입향한 지가 언제냐 하게 되면 에 이 경진년 천칠백 년에 여기에 동리에 입향을 하셨구만 여기에
천칠뱅 써이	천칠백이라고 써 있으니
끄어며 쩌어기 이 동리에 혹시 머 주위에 드리 널븐데들 말고 이 산도 야트마칸 산드리 쪼옴 인는데 혹시 산 이름메 대해서 사 알고 게신 산 이르메 대애서 함분 이야기 쫌 함 해 주이소	그러면 저기 이 동리에 혹시 뭐 주위에들이 넓은데들 말고 이 산도 야트막한 산들이 조금 있는데 혹시 산 이름에 대해서 산 알고 계신 산 이름에 대해서 한 번 이야기 좀 한 번 해 주십시오
여 우리 바래므 저 저 보인느 저 사니 바로 학쩡봉이러 그래임비덩	여기우리 바래미 저기 저 보이는 저 산이 바로 학정봉이라 그럽니다
저 학쩡봉을 웨 학쩡보이라 그인머이 저 사늘 보 꺼 트음마 하기 나라가느 형상이래야	저 학정봉을 왜 학정봉이라 그러냐 하면 저 산을 볼 것 같으면 학이 날  아가는 형상이에요
사니 저언 이이 저게 보마 하기 나라간는 사니라 그래 가주고 여이 이동네그에에에엠 아페 사늘 학쩡보이라꼬 그래불러꼬	아 산이 저 이 저기보면 학이 날아가는 산이라 그래 가지고 여기 이 동네 앞에 산을 학정봉이라고 그래음 불렀고
또 저어짜게 저게 보움 쩌 시내 아페 저짜아 또 둥그러여 추 저건누 호골사니라 그으러 호골산	또 저쪽에 저기 보면 저 시내 앞에 저쪽에 또 둥그런 저저것은 호골산이라 그래 호골산
끄르 호골사니라 그능 거는 뜨선 모르게써	그래 호골산이라 그런 것은 뜻은모르겠어
옌나레 저 범두리가 머 호평이라 그른데 범 호 짜가 드르 가주 즈 저걸 호구사니라꼬 지이따 소리도 이꼬 므 그커 그른 소리도 나온데 그게 화실치는아네어우우	옛날에 저 범들이 뭐 호평이라 그러는데 범 호 자가 들어 가지고저 저것을 호골산이라고 지었다는 소리도 있고 뭐 그 그런 소리도 나오는데 그게확실하지는 않아요
으 이 그 그르코 응 으 그 그게배께 머 사네 대항 건는 응 거 벨룸 멍	어이 그 그렇고 응그 그것밖에 뭐 산에 대한 것은 응 그 별로 뭐
산 사늠 머 한두 가지 두 개바께 업씀미까 이 근처에는	산 산은 뭐 한두 가지 두 개밖에 없습니까 이 근처에는
에혜예	예예
감태보이라 그능 거또저 감태봉은 맹 응 맹 학쩡보 산줄기이께네 끄언	감태봉이라 그러는 것도저 감태봉은 역시 응 역시 학정봉 산줄기니까 거기는
그어느 머 감태봉어 웨 감태봉임미까	거기는 뭐 감태봉은 왜 감태봉입니까
그기 옌나레 그으 으 끄 그 사네 대해 가지으우 읻 저 유래가 그미은 저 양밤 말뜨나 그 인제 그으 감투럴 마이 해따 그래 가주 감투보이라 큰다꼬도 어아 보늠 모애이세이 그래이	그게 옛날에 그그 그 산에 대해 가지고 이저 유래라 그러면 저 양반 말마따나 그 인제 그 감투를 많이 했다 그래 가지고 감태봉이라 그런다고도아 보는 모양일세 그래 예
거염 하저 학짱봉이 이꼬 호골사니 이꼬	그러면 학저 학정봉이있고 호골산이 있고
사니 이꼬	산이 있고
그다이미 감투봉 이꼬	그 다음에 감태봉 있고
고다임미 머 엉 이 감투봉이고	그 다음에 뭐이 감태봉이고
에머 다름 머 사으넉 크게 사니 그르케 여기너	어뭐 다른 뭐 산은 크게 산이 그렇게 여기는
업찌 머여	없지 뭐요
으 드리 널브서 잘 업쩐	어 들이 넓어서 잘 없지요
어이 어이예	예예예
혹시 골짜기 골짜기에 대해서 머 아심면 머 여 이 동네 골짜기 이르메 대  해서 인는 대로 함 이야기해 주십쑈	혹시 골짜기 골짜기에 대해서 뭐 아시면 뭐여기 이 동네 골짜기 이름에 대해서 있는 대로 한 번 이야기해 주십시오
요 디 꼬오릉 바로 드간느 산수꼬르어 그으고 은 저짜아 드가능 건능 건 머응어 신시꼬르에 글고 저 우에 가서느 모꼬리라 그으공 윽 그래 부른데 귿뜨슨 모르게썽언	요기 뒷 골에 바로 들어간 곳은 산수골이라고 그러고저쪽으로 들어간 것은 뭐신시골이라고 그러고 저 위에 가서는 못골이라 그러고 어그렇게 부르는데 그 뜻은 모르겠어
먼 띠므 그런지	음 뭐 때문에 그러는지
사 산시꼬리여	산 산수골이요
산수꼬염	어 산수골
산수꼬리르 산수꼬엠	산수골이야 산수골
웨으 산수꼬른 머 웨 그런지름 모르은다 그지에	왜 산수골은 뭐 왜 그런지는 모른다 그렇지요
모르제 그케용	모르지 그러게요
그다으미 산수꼬 리꼬 그다엠 모꼴 리꼬	그 다음에 산수골이 있고 그 다음에 못골이 있고
모꼬 리꽁	못골 있고
모꼴도 뜨슨 잘 모름미까	못골도 뜻은 잘 모릅니까
웨 모꼬린지	왜 못골인지
그르쩨으에 그에 지금도 모선 이이써써 거게가 모꼬 저 모꼬레아	그렇지어 그 지금도 못은 있어 거기에 못 저 못골에
요래 쩌 그 머 물 땔라끄 노네 물 때앤 내애 머 어어 즈 인저 쪼끄머 인제그이 이쓰께쩨	요래 저 그 뭐 물 대려고 논에 물을 대 내는 뭐저 인제 조그만 인제 그게 있었겠지
또 여게는 디 그르코	또 여기는 저 그렇고
여 산수꼬른 근 믄 자시 모르게써 그 사네서 무리 난다구 산수꼬라 그르 짠나구 나는 생가깐데 귿 뜨슨 확씨리 모르게써에	여기 산수골은 그것은 뭐 자세히모르겠어 그 산에서 물이 나온다고 산수골이라 그랬지 않나 하고 나는 생각하는데그 뜻은 확실히 모르겠어요
그다엠 모 모꼴레늠 모시 예저넫 이스꺼 지음도 조그만항 게 이꼬 그다음메 여쭈어 산수꼬리고 그담 저쭈게 신시꼴 그래쓰미	그 다음 못 못골에는 못이예전에 있었고 지금도 조그만한 게 있고 그 다음에 요쪽에 산수골이고 그 다음 저쪽에 신시골 그랬습니까
신시꼴 씨에이 시내그 신시골	어 신시골 신 신 신시골
그거는 자시 모르게써 금 무 웨 신시꼬러 그은지	그것은 자세히 모르겠어그 뭐 왜 신시골이라 그랬는지
자시 모르게써여 그 뜨선 모르게따꼬	자세히 모르겠어요 그 뜻은 모르겠다고
여게느 그름 표시기 이쓰이께네 이으 저으도 무리 나이게 산수꼬리고 저짜아늠 모시 이께느 모꼬래 그르따욱 보는데 현재도 그언 이쓰이께네	여기는 그런 표식이 있으니까 이 저기에도 물이 나니까 산수골이고 저쪽에는 못이 있으니까못골이라 그랬다고 보는데 현재도 그것은 있으니까
그릉꺼 어째뜬 점부 골짜기너 주로 그런 머 디 꼬홀모꼴 산수꼴	그러니까 어쨌든 전부 골짜기는 주로 그런 뭐 뒷 골못골 산수골
산수꼴 시내시꼴	산수골 신시골
신시꼴	신시골
평꼴	신시골 예
이을 세 개가 이꼬 머 또 다릉 꼴짜기는 잘 업씀미까	이렇게 세 개가 있고뭐 또 다른 골짜기는 잘 없습니까
업써 다릉 골싸기 그 머 어데 다는 몰씨더 그	없어 다른 골짜기 그 뭐 어디 다는 모르겠습니다 그
사니 그르케 만치가 아너서	산이 그렇게 많지가 않아서
예아	예
그러며 혹씨 여기 들강은 강에으 강은 여기 쫌 이씀미까	그러면 혹시여기 들강은 강 강은 여기 좀 있습니까
강에이 아이래 여 내성천 거랑이지 머예	강이 아니라 여기 내성천 개울이지 뭐요
내성처네서 나오능 거이기 이게 흘러 가주고 저 예천 아프로 저리 간데 이게 내성처니러 강이라 그진 난내 여 내성천 또라이라 그르지	내성천에서나오는 것이 이게 흘러 가지고 저 예천 앞으로 저리 가는데 이게 내성천이라 강이라 그러지는 안 안 해 여기 내성천 도랑이라 그러지
그어므 여기 지옴 봉화 읍내 아프로 흐르능 큰 이게	그러면 여기 지금 봉화읍내 앞으로 흐르는 큰 이게
내성처니지요	내성천이지요
내성처니고 그다으메 혹씨 이내성처느로 흘러 드르가는 조옴만한 그랑이나 이렁 건 업씀미까	내성천이고 그다음에 혹시 이내성천으로 흘러 들어가는 조그만한 개울이나 이런 것은 없습니까
여어서 나어능 게 저 정꼴써 나오능 게 쪼매항 게 이 이 이 아프르도 내리가능 게 쪼매낭 건 이써도우 그건느 이르미 업짜네 그건능	여기에서 나오는 게저 정골에서 나오는 게 조그마한 게 이 이 이 앞으로도 내려가는 게 조그마한 것은 있어도 그것은 이름이 없잖아 그것은
그르지 기냥 거라이라 그르지 머요	그렇지 그냥 개울이라 그러지 뭐요
