dialect	standard
그게 에 가스미 가스미 갱장이 이 빠개저 나가능 거그치 아품니다	그게 에가슴이 가슴이 굉장히 이 빠개져 나가는 것같이 아픕니다
심장이 발 발짜글 하고	심장이 발작을 하고
그개 저 심근경새기라구 하능 거연나부내요	그게 저 심근경색이라고 하는 거였나 보네요
그르치요	그렇지요
싱근 영새기지요	심근경색이지요
으 경새긴데	심근 경색인데
그 인재 츠매 발짜걸 해따가 낭중앤 자꾸 더해 가주고 세 번챈 대수술를 해야된다 고라더라고요	그 이제 처음에 발작을 했다가 나중에 자꾸 더 해 가지고 세번째는 대수술을 해야 된다고 하더라고요
그래가주구 이 가스물 요래 뚝빠개짜너요	그래가지고 이 가슴을 이렇게 쭉 빠갰잖아요
포가 나지요	표가 나지요
아아	아
이 월개 예예	예예
포가 나지요	표가 나지요
여 요까지 다 이 아주 여러노코 핻 항 거요	여 요기까지 다 이 아주 여러 놓고한 거예요
그러먼 이 피쭈럴 여길 뺌미다 요거	그러면 이 핏줄을 여기를 뺍니다 요거
이댄 피쭈럴 혈가널 빼 가주고	이 댄 핏줄을 혈관을 빼 가지고
요기 빼구 요 요기서 여기 이 다 빼구	여기 빼고 요 요기서 여기 이 다 빼고
요까지 요거 다 뺌미다	요기까지 요거 다 뺍니다
다 빼요	다 빼요
가따 이서 농 거지요	갖다 이어 놓은 거지요
허허	허허
그래 살고 이찌요 지금	그래 살고 있지요
허허	허허
그래두 의수리 조아서	그래도 의술이 좋아서
에에 그래요 의수리 조아서	예 그래요 의술이 좋아서
다 중는다 그래쬬 뭐 그때는	다 죽는다 그랬지요 뭐 그때는
그개 저 혈과니 이르캐 오 쪼라드러 가주구 그렁 거자나요	그개 저 혈관이 이렇게 졸아들어 가지고 그런 거잖아요
피가 안 통해서	피가 안 통해서
그르쵸 안 통하조	그렇지요 안 통하지요
안 통해 가주구 인재	안 통해 가지고 이제
그 수술할라구 들먼 그 이 저	그 수술하려고 들면 그 이 저
심장	심장
심장이 이 피쭈머니 아니유	심장이 핏주머니 아니요
팍팍팍하는대 그 피 팍팍팍 가능 기 지그먼 다 나타남니다	팍팍팍하는데 그 피가 팍팍팍 가는 게 지금은 다 나타납니다
아주 저기	아주 저기
현대시그로 대 이써 가주구	현대식으로 되어 있어 가지고
아주 수수라능 기 다 보이두룩 그르캐 대이찌요	아주 수술하는 게 다 보이도록그렇게 되어 있지요
그 하라부지 태어나셔서부터 지금까지 사라오신 내려개 대애서 한 번 얘기 줌해주새요	그 할아버지 태어나셔서부터 지금까지 살아오신 내력에 대해서 한번얘기 좀 해 주세요
머 하이튼 얜날 얜나래 놀등 거 머 칭구들 머 머하구 이렁 거	뭐 하여튼 옛날옌날에 놀던 거 친구들 뭐 뭐하고 이런 거
예예	예
그렁	그런
하이튼 머 하실 말씀 인능 거 다 한 번 얘기해 줘 보새요	하여튼 뭐 하실 말씀있는 거 다 한 번 얘기해 줘 보세요
그렁건 머 얘기할 쑤 있지요	예 그런 건 뭐 얘기할 수 있지요
나는 인재 이 지배서 태어난 사라밈미다	나는 이제 이 집에서 태어난 사람입니다
이 지배서	이 집에서
에 이 지배서 태어나꾸	에 이 집에서 태어났고
이 아주 초갇찌비써써요 지비 옌나래	이 아주 초갓집이었어요 집이 옛날에
아주 초가찌비고	아주 초갓집이었고
이 집 이 뜨러기 한 질 댐니다	어 이 집 이 뜰이 한 길 됩니다
한 질	한 길
그런 초가찌배 사라서 살민성 태어난 사라미요 내가	그런 초갓집에 살아서 살면서 태어난 사람이에요 내가
그런대아번님깨서 일찌기 도라가시찌요	그런데 에 아버님께서 일찍이 돌아가셨지요
그라구 이재 어먼님하구 인재 눈님덜 둘 인재 동생 한 사람	그리고 이제 어머님하고 이제 누님들 둘 동생 한 사람
그래 나아고 고래 사남매가 여기서 사라찌요	그 나하고 그렇게 사남매가 여기서 살았지요
그런 쪽 머 여기두 옌나래 아주 초님미다	그런 죽 뭐 여기도 옛날엔 아주 촌이었습니다
아주 초니니까 머	아주 촌이니까 뭐
그냥 농사진는 초니니까	어 그냥 농사짓는 촌이니까
읻 나무도 지개로 저다가 사내 가서 저다가 불 때 가밍서 밥패먹꼬 살고	이 나무도 지게로 져다가 산에 가서 져다가 불 때 가면서 밥 해 먹고 살고
그래 살다보니까 결구건 어디 나가본 대두 우꼬	어 그래 살다 보니까 결국은 어디 나가 본 데도 없고
그 일찌기 도러가셔쪼	그 일찍이 돌아가셨지요
아번니미 나 스물한 살 때 도라가시쓰니까	아버님이 나 스물한 살 때 돌아가셨으니까
머 내가 다 인재 에 집 채기멀 맏따시피 하고 사라끼 때미내	내가 다 이제 에집 책임을 맡다시피 하고 살았기 때문에
여기 내려근 대주 대충 다 암니다	여기 내력은 대충 대충 다 압니다
그러면 하라번니미 장나미싱가요	그러면 할아버님은 장남이신가요
내가 장 장나민대 눈님덜 두리꼬	내가 장 장남인데 누님들 둘 있고
동생은대정가 살다 삼년 저내 주거써요	동생은 대전에 가서 살다가 삼년전에 죽었어요
나보다 먼저 주거찌요	나보다 먼저 죽었지요
그러면 누님드른뇨	그러면 누님들은요
누님드런 인재 지금 사라 개심미다 두 분 다	누님들은 이제 지금 살아 계십니다 두 분 다
한 부넌그르닝깨 팔씹 여서시지요	한 분은 에 그러니까 팔십여섯이지요
둘째 누니먼 팔씹 섿	둘째 누님은 팔십 셋
그 나는 팔씹	나는 팔십
내 동생은 세 살 터우리조	내 동생은 세 살 터울이지요
그르닝깨 내 동상언 칠씨빌곱 지금 사라 이쓰먼	그러니까 내 동생은 일흔일곱지금 살아 있으면
그럼 누님뿐드른 어디 사세요	그럼 누님분들은 어디 사세요
한 부넌	한 분은 에
츠매넌 인재 요 백짜릴리라고 요 가까운대로 시집벌 간는대	처음에는 이제 요기 백자리리라고 요기 가까운 데로 시집을 갔는데
에 지그먼 인재 사능 거넌 저 청주 가 살구 이써요	에 지금은 이제 사는 건저기 청주에 가서 살고 있어요
청주	청주
청주애 내가 따리 한 따리 딱 하난대	청주에 내가 딸이 한 딸이 딱 하난데
따라나하구	딸 하나 하고
고고 아더리 또 두째 아더리 고가 살고 이끼 때매	그그 아들이 또 둘째 아들이 거기에 살고 있기 때문에
거기서 살구 이찌요 지금	거기서 살고 있지요 지금
그라구 인재 자근 누니먼 요 청사니라카는대 살고 이꼬요 지금	그러고 이제작은 누님은 여기 청산이라고 하는데 살고 있고요 지금
청산	청산
다 정정하시구요	다 정정하시고요
근대 지금 다 정정하지 안치요	그런데 지금 다 정정하지 않지요
기도 어두꼬	귀도 어둡고
또 모미 다 조털 아나조	또 몸이 다 좋지 않지요
그르캐	그렇게
또 자근 누니먼 허리가 이 꼬보랑 함니다	또 작은 누님은 허리가 꼬부랑 합니다
머 좀 환자 테기지요 머	뭐 좀 환자 같지요
가끔 이르캐 만나시거나	가끔 이렇게 만나시거나
만내지요	예 만나지요
일려내 한 번 쓰건 만내고	일년에 한 번 씩은 만나고
두 번두 만내기두 하고 만내지요	두 번도 만나기도 하고 만나지요
절물 절물 때 가치 클 때보다 더 요새 만나면 더 새록새로 카지시요	젊은 때같이 클 때보다 더 요새 만나면 더 새록새록하시지요
그르치오	그렇지요
근 머 참 늘거갈쑤록자꾸 만내쓰먼 하는대	그건 뭐 참 늙어갈수록자꾸만났으면 하는데
자주 몸 만내지요 더 옌날보담	자주 못 만나지요 더 옛날보다
인재 나이 머꾸 이라닝깨 점점 더 몸만내요	이제 나이 먹고 이러니까 점점 더못 만나고
일려누 멥뻔씩 만내 써 만내서 하는대	일 년에 몇 번씩 만나서 만나서 하는데
지그먼 인재 활똥려기 즈거저 가주구 와따가따 자주 모타지요	지금은 이제 활동력이 작아가지고 왔다 갔다 자주 못 하지요
그러면 스무 살 스무란 살 이때 선친깨서 도라가시고	그러면 스무 살 스물한살 때 선친께서 돌아가시고
그리구 인잳 농사지싱거요 그럼	그리고 이제 농사지으신 거예요 그럼
그르치오	그렇지요
농사럴 참 여러 가지 해씀니다	농사를 참 여러 가지 했습니다
농사도	농사도
근대 이 농사를 지따 보니까	그런데 이 농사를 짓다 보니까
고 땅이 만치 안초	그 땅이 많지 않지요
여기 땅이 마는대가 아님미다	여기 땅이 많은 데가 아닙니다
아주 살기가 어려운지여기여써요	아주 살기가 어려운 에 지역이었요
그래서	그래서
이 그라고 옌나래 지금도 마창가지지만	이 그리고 옛날에는 지금도 마찬가지지만
이 농사질 땅이 여기 저기 이래 부터이씀니다	이 농사질 땅이 여기 저기 이렇게 붙어 있습니다
그라먼 이 지개로거러멀 저다가	그러면 이 지게로 에 거름을 져다가
버 가주고 그 누멀 가주고 인재 에 퇴비 하 해 가주고	부어 가지고 그 놈을가지고 이제 에 퇴비를 해 가지고
농살 지키타보먼 보통 고여기 아니지요	농사를 짓다 보면 보통 고역이 아니지요
그리고 요 땅이 존 지여기 아니애요	그리고 여기 땅이 좋은 지역이 아니에요
토오카질 안씀미다 요개	토옥하질 않습니다 여기
저 잘 안 대지요	잘 안 되지요
곡씨기	곡식이
그래두 이 농사꺼리는 머 만치도 앙코 이래서	그래도 이 농사거리는 뭐 많지도 않고 이래서
여러 가지 농살 지바찌오	여러 가지 농사를 지어 봤지요
바태는 담배도 싱가 보고	밭에는 담배도 심어 보고
인삼도 해 보고	인삼도 해 보고
머 이 채소장물도 해 보고	뭐 이 채소 작물도 해 보고
별걸 다 해바써	별 걸 다 해봤어
근대 팔로가 조칠 안치요 여긴 또	그런데 판로가 좋질 않지요 여긴 또
그릉 건 옌나래	그런 건 옛날에 음
에 인재 옌나랜 경웅기 이렁 개 나와 가주 인재	에 이제 옛날에 경운기 이런게 나와 가지고 이제
경웅기로도 가따 팔고	경운기로도 가져다 팔고
그 아주 옌나래넌 소나 이렁 걸로 씨르다가 팔든지	그 아주 옛날에는 소나 이런 걸로 실어다가 팔든지
지개루 저다 파라야 대요	지게로 져다 팔아야 돼요
그라고 인재 여기 장이 여기도 장언 슴미다	그러면 이제 여기 장이 여기도 장은 섭니다
그걸 인재 여러 군대 갈라먼	그걸 이제 여러 군데를 가려면
여기 세군대 장언 갈 쑤가 이써요	여기 세 군데 장은 갈 수가 있어요
세 군대	세 군데
영동 장	영동 장
영동 장이 잴 크지요	영동 장이 제일 크지요
항간 장	황간 장
청산 장	청산 장
인재 여기 장이 스니깨 여기 장 보고	이제 여기 장이 서니까 여기 장 보고
그렁 걸 맹그러노먼 그르캐 도라 댕기민 파라야 대요	그런 걸 만드러 놓으면 그렇게 돌아 다니면서 팔아야 돼요
그으	그
그 수아기 별로요 일려내	그 수확이 별로요 일 년에
사라온 내여걸 얘기해 보머뇨	살아온 내역을 얘기해 보면요
농토는 얼마나 대션는대요	농토는 얼마나 대셨는데요
농토는약 한 전채애서 한 이천 평 정도 부처 보고	농토는 약 한 전체에서한 이천 평 정도 부쳐 보고
그래 아드리 여러시니까 자꾸 학삐애 파라머거야 대요	그래 아들이 여럿이니까자꾸 학비에 팔아먹어야 돼요
그래 자꾸 줄과찌요 머	그래서 자꾸 줄였지요 뭐
그 학삐럴 점부 내고 학 공부시켜씀니다	그 학비를 전부 내고 학 공부시켰습니다
한 사람도 혜택뽄 니리 업써요	한 사람도 혜택본 일이 없어요
수업뇨 다 내야 대고	수업료 다 내야 되고
기성해비 다 내야 대고	기성회비 다 내야 되고
머 일리리 다 내가민성 공부 시키찌요	뭐 일일이 다 내가면서 공부를 시키지요
그래 대학교 한 사람배깨 모 시키써요	그래 대학교 한 사람밖에 못 시켰어요
그라고점부 고동학꾜 중학꾜애 끈마 끈마치기도 하고	그리고 에 전부 고등학교 중학교 끝마 끝마치기도 하고
그런 곡씨글 시물 때 제일 그래도 수하기 마능 개 어떵거여써요	그런 곡식을 심을 때 제일 그래도 수확이 많은 게 어떤 거였어요
도우미 마니 댕거	도움이 많이 된 거
수하기 마이 댕거넌 그래두 잘 지먼 인사미 잴 나찌요 머	수확이 많이 되는것은 그래도 잘 지으면 인삼이 제일 낫지요
그라고 인재 담배가 땅거보담 수하기 좀 나닝까	그리고 이제 담배가 다른 것보다 수확이 좀 나으니까
이 건조시래 옌날 걸조시런 이 흐그로 싸 올린 흑뼉	이 건조실에 옛날 건조실은 흙으로 쌓아 올린 흙벽
거기 그렁 기 건조시림니다	거기 그런 게 건조실입니다
지그먼 인재 다 이 기개 건조시리지요	지금은 이제 다 이 기계 건조실이지요
그른대 에 그 두 개까지도 가지구 담배 농사두 해 바써요	그런데 에 그 두개까지도 가지고 담배 농사도 해 봤어요
근대 인삼 농사넌 그 한 심년 해써요 인삼 농사럴	그런데 인삼 농사는 한 십년 했어요 인삼 농사를
인삼 농산 참 그거는 어렵씀니다	인삼 농사는 참 그것은 어렵습니다
인삼 농사	인삼 농사
이 땅얼 일련 간 무커야 대요	이 땅을 일년 간 묵혀야 돼요
거 인삼 거르멀 할라먼	인삼 거름을 하려면
아주 그개 옌나랜	아주 그게 옛날엔
그라고 옌나래 한시보 년 저내 잉삼 농살 해써요	그리고 옛날에 한 에십오 년 전에 인삼 농사를 했어요
그때만 해도 지금 인삼 농사하고 다름니다 지그먼	그때만 해도 지금 인삼 농사하고 다릅니다 지금은
그때넌 푸럴 해다가 바태다 까라 가주구 소로 가라 가주 디지버 가주구 그걸써쿰니다	그때는 풀을 해다가 밭에다 깔아주고 소로 갈아 가지고 뒤집어 가지고그걸 썩힙니다
그 저 가랑닙꺼틍 걸 이렁 걸	그 저 가랑잎 같은 걸 이런 걸
인삼 농사진능 건 보시쓸 끼여 더러 교순님도	인삼 농사 짓는 건 보셨을 거야 더러 교수님도
그르캐 하며넌 그 심 년쭈건 해야지	그렇게 하면 그 십 년쯤은 해야지
그래도 그 수하걸 재대로 볼 쑤가 이써요	그래도 그 수확을 제대로 볼 수가 있어요
그 짜료럴 안 내뿌릴라만	그 재료를 안 내버리려면
그래 가주구 이기 씨럴 일련 키와야지요	그래 가지고 이게 씨를 일 년 키워야지요
그래 또 사년	그래 또 사년
지금 여긴 융년근 농사 여가내 안 진 몯 찜니다 여기는	지금 여긴 육년근 농사여간해서 안 짓 못 짓습니다 여기는
융년그니야 거 홍삼이죠	육 년근이야 홍삼이지요
근대 인재 여기는 뱅싸무루 다 파라야 댐니다	그런데 이제 여기는 백삼으로 다팔아야 됩니다
그라먼 그기 에 얼매 걸리나먼 융 년 걸림니다	그럼 그게 얼마나 걸리느냐하면육 년 걸립니다
융 년	육 년
융 년 걸리고 함 번 딱카먼 전부 소냄니다	육 년 걸리고 한 번 딱 하면 전부손해입니다
한 번만 암만 자래따캐도 소내여	한 번만 아무리 잘 했다고 해도 손해야
자료드러강 기개	재료 들어 간 게
근대 이걸 오래하고 수이벌 좀 더 볼라먼	그런데 이걸 오래하고 수입을 좀 더보려면
게소캐서 연자걸 해야 대넝 거여	계속해서 연작을 해야 되는 거야
게소캐서	계속해서
근대 그거뚜 또 여 여유치 아눕띠다	그런데 그것도 또 여의치 않습디다
그래서 한 심년 간 따카고 마라찌요	그래서 한 십 년간 딱 하고 말았지요
하라부지는 여기서 나서 여 이지배서 나셔서 이지배서 쭉 사셔꼬	할아버지는 여기서 나서 이 집에서 나셔서 이 집에서 쭉 사셨고
그개 그르니까 팔씸 년 여기서 사션내요	그게 그러니까 팔십 년 여기서 사셨네요
그르쵸	그렇죠
지금 연새애	지금 연세에
왱기지 아낟씀니다	옮기지 않았습니다
연새가 여드니라고 하시니까	아 연세가 여든이라고 하시니까
그 잔나비띠라고 그러셔쬬	그러니까 잔나비띠라고 그러셨죠
그러고 인재 크싱거뚜 여기서 크셔꾸 그지요	그리고 크신 것도 여기서 크셨고그렇지요
그러쵸	그렇죠
학꾜는	학교는
학꾜는 지금 여 구령초동학꾜가 인넌대 저 용산초동학꾤 댕기써요	학교는 지금여기 구룡 초등학교가 있는데 저 용산 초등학교를 다녔어요
그기 잴 먼저 설리비 대떤 학꾜요 여기넌	그게 제일 먼저 설립된 학교요 어기는
그때는 이르미 머여써요	그때는 이름이 뭐였어요
그때 그때도 동수리지요 사묻	그때도 동술이지요 사뭇
아니 학꾜 이름	아니 학교 이름
학꾜 이름	학교 이름
용산궁민학꾜요	용산 국민학교요
그때 용상궁민학꾜라캐요	그때 용산 국민학교라고 해요
일쩡 때	일정 때
진 학꾜니까	지은 학교니까
그러면 그때 면년 간 다니셔써요	그러면 그때 몇 년 간 다니셨어요
융 년뇨	육 년이요
융 년	육 년
융 녀니지요	육 년이지요
그러면 일째때 그말기나요 일째	그러면 일제 때 그 말기였나요 일제
일째 말기죠	일제 말기죠
일째 말기	예 일제 말기
오 오항년까징 거기서 다니고	오 오학년까지는 거기서 다니고
인재 참 저 일 일쩡 교유걸 바꼬	이제 참 저 일 일정 교육을 받고
일항 이래 일항년만 거 유캉년 때만항글 배우고	에 일학 일학년만그 육 학년 때만한글 배우고
조러블 해찌요	졸업을 했지요
그때는 그러면 나이가 어느 쩡도 대쓸때 다녀써요	그때는 그러면 나이가 어느 정도 됐을 때 다녔어요
그때는 연새분 드신분들도 다니고 막 그래따 그래대요	그때는 연세분 드신 분들도 다니고 막 그랬다 그러대요
그러쵸	그렇죠
장개 간 사람도 다니써요	장가 간 사람도 다녔어요
장개간 사람도 가치 다녀써요	장가 간 사람도 같이 다녔어요
하라번니문 그때 연새가 어어	할아버님은 그때 연세가
그링깨 드러갈 째 아옵쌀 때 드러간나요	그러니까 들어 갈 적에 아홉 살 때 들어갔나요
아홉 쌀 때	아홉 살 때
옌나랜 지금가치 머 일곱 쌀 여서 쌀로 아나죠	옛날엔 지금같이 뭐 일곱 살여섯 살로 안 하지요
더 느깨 가지요	더 늦게 가지요
초동학꾜	초등학교
그리구 나서 그럼 학꾜 마치구서는	그리고 나서 학교 마치고서는
학꾜 마치고부터먼 농사일 해쬬	학교 마치고부터는 농사일 했지요
농사	농사
농사일	농사일
농사일 하다가 하하 유기오 사벼니 나 가주 인재	농사일 하다가 하하 육이오사변이 나가지고 이제
구닌 가따 오고	군인 갔다 오고
전쟁언 아내씀니다	전쟁은 안 했습니다
유기오 때는 그럼 어트개 지내셔써요	아 육이오 때는 그럼 어떻게 지내셨어요
유기오 때 그 유기오가 이	육이오 때 그 육이오가 이
용사니 여기 전장텀니다	용산이 여기가 전쟁터입니다
진짜 여 아주 빽쩌늘 한 대요	진짜 여기 아주 백전을 한 데요
요거 아주 유명한 댐니다	요기가 아주 유명한 데입니다
옌날부터 이 전장이 부터따하먼	옛날부터 이 전쟁이 붙었다 하면
전장하문서 치르는 니 동내라고 그라는데	전쟁하면서 치르는 이 동네라고 그러는데
여 사람 마이 주거써요	여기 사람이 많이 죽었어요
인임군도 마이 죽꼬	인민군도 많이 죽고
여 미군두 와서 여기 주두내 가주고 전장한 대요	여기 미군도 와서 여기에 주둔해 가지고 전쟁한 데요
미군 여 유기오 때 츰	미군 여기 육이오 때 처음
저 대전하고	저 대전하고
대전서 전장하고 나면 여기 에 진찌 구추캐 가주구 여기 와서 전장한 대요	대전에서 전쟁하고 나면 여기 에 진지 구축해 가지고 여기 와서 전쟁한 데요
그래서 전장이 이러나니까 머 피라늘 앙 갈 쑤가 업쬬	그래서 전쟁이 일어나니까 뭐 피란을 안 갈 수가 없지요
그 피라널 알루 니리간다능 기 가다 가다가 저	그 피란을 아래로 내려간다는 게 가다가 가다가 저
성조 그러닝깨 낙똥강	성주 그러니까 낙동강
지금 저 왜 왜간 거 다리 끄너전 그 다리	지금 저 왜 왜관 거기 다리 끊어진그 다리
그걸 모껀내 가고 우린 대로 올라와쬬	그걸 못 건너가고 우린 도로 올라왔지요
저녕 거 내리가다봉깨 그 머 차다니 대 가주구 모까개 하니 머 할쑤 웁쬬	저녁 거 내려가다 보니까 그 뭐 차단이 돼 가지고 못 가게 하니 뭐 할 수 없지요
그래 다시 올라와 가주	그래 다시 올라와 가지고
그른대 지내다가	근데 지내다가
해복 참 저구닌더리 인재 우리 국꾼더리 이 올라와 가주	회복 참 저 에군인들이 우리 국군들이 이 올라와 가지고
그냥 그대로 살다가 이재 정시그로 가는 군대로 가쬬	그냥 그대로 살다가 이제 정식으로 가는 군대로 갔죠
제주도 가서 훌려는 바꼬	제주도 가서 훈련은 받고
그 그 유기오 때 얘기 줌 해줘 보새요	그 그 육이오 때 얘기 좀 해줘 보세요
그때 상황이 어땐는지	그때 상황이 어댔는지
상항언 여기 아주 시만 전투럴 한대라나서	상황은 여기 아주 심한 전투를 한데라놔서
이 부리 싹 이 동내가 싹 타써씀니다	이 불이 싹 이 동네가 싹 탔썼습니다
싹 타고	싹 타고
그 가따 오는 온 그 결과를 쪼꿈 얘기해 보먼	에 그 갔다오는 온 그 결과를 조금 얘기해 보면
지금 저 심무내 노근니라고 마이 나오지요	지금 저 신문에 노근리라고 많이 나오지요
노근니 사꺼니라고	노근리 사건이라고
예예예	예
이재 우리가 피란갈 때는 저짜그로 이래 도라서 철 첟 천 천날 피라넌 여덕찐동이라는대 가서 피라늘 하고 하루찌녁 자고	음 이제 우리가 피란갈 때는저쪽으로 돌아서 철 첫 첫날 피란은 여기 덕진동이라는 데 가서 피란을 하고 하루저녁을 자고
발쌔 막자꾸 인재 후태해 내리오고 이라는대 그거럴 참 기가 매킨 꼴두 보지요 우리	벌써 막 에 자꾸 이제 후퇴해 내려오고 이러는데 그거를 참 기가 막힌 꼴도 보지요 우리가
이재 이 덕찐가서 막 피란 하루찌녁카는대 임민구니 막 선발 때 와써요	이 덕진 가서 막 피란을 하루 저녁을 하는데 인민군이 막 선발대 왔어요
그 덕찐동이라는대 와써요 와써	그 덕진동이라는 데 왔어요 왔어
그래 막 지내가고 이써요 아패	그래 막 지나가고 있어요 앞에
피란미니랑 가치 지내가능 거 우리가 모껴글 하고 봐써요 우리	피란민이랑 같이 지나가는 것을 우리가 목격을 하고 봤어요 우리가
그래도 어트감니까	그래도 어떻게 합니까
자꾸 피라늘 갈 쑤배끼	자꾸 피란을 갈 수밖에요
전장은 여기서 안 안즉 아나는대	전쟁은 여기서는 안 아직 안 하는데
이재 그라고차차차차 찬차이 니리가능 거지요	그리고차차차차 천천히내려가는 거지요
우리넌 거러서	우리는 걸어서
소도 함 마리 몰고 가지 아들 등애 어꼬 지고	소도 한 마리 몰고 가지 아들등에 업고 지고
인재 그때마내두 뭐인재 초동하꾜 재우 조러파고 구닌 갈 나이는 대쓰니까	이제 그때만 해도 뭐이제 초등학교 겨우 졸업하고 군인 갈 나이는 됐으니까
머 질머지구 댕기고 아들도 가치 막 질머지고 이래 내리가찌요	뭐 짊어지고 다니고 아이들도 같이 막 짊어지고 이렇게 내려갔지요
그래 인재 우리 니리갈 때 막 점부 여기 에 전장 준비함니다	그래 이제 우리내려갈 때 막 전부 여기 에 전쟁 준비합니다
그링깨 여기넌 전장터니까	아 그러니까 여기는 전쟁터니까
야포넌 바 저 요 너매 당지그튼대 저 항간그튼대 가따포진찌 차려 노코	아 야포는 저 요 넘어 당지 같은데 저 황간 같은 데 가져다 포진지를 차려놓고
우리가 인재 전쟁하능 걸 보구 내리가능 거여 막	우리가 이제 전쟁하는 걸 보고 내려 가는 거요 막
여기 전장하넝 걸	여기 전쟁하는 걸
이 우리우리 아구니 구꾸니 포 쏘능 기 보임니다	이 우리우리 아군이 국군이 포 쏘는 게 보입니다
보이고 가서 떠러지넝 거뚜 보이고	보이고 가서 떨어지는 것도 보이고
폭파라넝 거또	폭발하는 것도
