dialect	standard
그른데 고 인지아 항 가지가 또 쪼꼼 묘심당 기아 에 아허니 술짜늘 올릴찌게 수 술짜음 올리 노으먼 그읃 지 자늘 읃 퉤자늘 쓰게지 앙코 종허니 뜨옹 올릴 땐 즈 찌 종허는 자늘 그 밥뚜껑에다 수럴 부어 가즈 첨자니라꾸 세번씩 개요	그런데 그 인제 한 가지가 또 조금 묘한 게아헌이 술잔을 올릴 적에 술 술잔을 올려 놓으면 잔을퇴잔을 시키지 않고 종헌이 또 올릴 때는 저저 종헌은 잔을 그 밥뚜껑에다 술을 부어 가지고 첨잔이라고 세 번씩 해요
종어네	종헌에
제일 끄테 세 번째 찌 잔 올린 사럼머 인제 요래 바다가주 양 애분애은떼 쪼꿈 세 번쓰익 첨자는 해여	제일 끝에 세 번째 저 잔을 올리는 사람은 인제 요래받아 가지고 양 어른한테 조금 세 번씩 첨잔을 해요
참 머 고골 인제 에 참 첨자이라 그러구	참 뭐 그것을 인제참 첨잔이라 그러고
그래먼 인제 종허니 에 이 재배을 하고 마을까 치먼 고다으멘 인젭 으음밥수까라글은제 이 메라 그래니더 그어 바블 해 농 거	그러면 인제 종헌이어 이 재배를 하고 마쳤다 치면 그 다음에는 인제밥숟가락을인제 이 메라그럽니다 그 밥을 해 놓은 것
거일 뚜껑을 여으고 어어으 그 우에 인제 수 수까라글 은제 꼬바 논니더 그래 인지 즈 무레 적쎼 갇	거기를 뚜껑을 열고그 위에 인제 숟 숟가락을 인제 꽂아 놓습니다 그래 인제 저 물에 적셔 가지고
그러겨 또 인제 쫑앙내이 즈 삽씨 데먼 삽시정저이라 그는데 근 메 저 이이으 근 에롬 마리고요 그래 삽시라 그능 여 수까락 꼬바 노코 인제 그려 무레 또 고 세 번 푸러 가주어 지 재차 노우먼 고게 인제 삽시정저이라 근데 그래고 나먼 그 웨 인 뚜 고다으메 읻 종오니 인제 잔 올리구어 종헌니 잉 잉 헌달 하기 데믄 고다으메늠 각 제관드려이 저럴 또 두 번 하네다	그러고 또 인제저 저 삽시 되면 삽시정저라 그러는데 그 뭐 저 이 이 그것은 어려운 말이고요그래 삽시라 그러는 것은 숟가락 꽂아 놓고 인제 그래 물에 또 그 세 번 풀어 가지고저 재차 놓으면 그게 인제 삽시정저라 그러는데 그러고 나면 그 왜 이 또 그 다음에 이 종헌이 인제 잔 올리고 종헌이 이 이 헌다를 하게 되면 그 다음에는 각 제관들이 절을 또 두 번 합니다
어녕 인지 작뼐제으저	어 이제 작별제이지
이 작뼐제제 태기지여	이 작별제인 셈이지요
으 잘 가시요 하능 걷 씨그로 저럴 두 번 하먼 제사 은지 철싸이러 근느제사 다 지내따고 그래먼 그날 기제산 다 지냉 기래	어 잘 가세요 하는 그 식으로 절을 두 번 하면 제사 인제 철상이라 그러는 제사 다 지냈다고 그러면 그날기제사는 다 지낸 거야
그담 그어기 어얻 제사어 철상하고 나면 엄보글 함미까	그러면 거기 제사 철상하고 나면 음복을 합니까
예 어은	예예
음복수주라꼬예 음보글 하니더	음복수주라고요 음복을 합니다
음보걸 제관드리 방에 모예 안지미 인제 그 아네서는 은 나 아음 메 인제그 제사에 서떤 제무를 점부 인제 풀고 이래 에임 머 업 마아 가주구 인제 쓰쓷 또 담고 하야 해 가주고 그래음보글 하니더	음복을 제관들이 방에 모여 앉으면 인제 그 안에서는어뭐 인제 그 제사에 썼던 제물을 전부 인제풀고 이래뭐모아 가지고 인제 저 또 담고 해 해 가지고 그래음복을합니다
방에 와가주 인제 에 상그 은제 이 제관들끼리 일가 친척 또 머 그날참서캐떰 분들 모동 안자 가주우 음보글 하우 하고 인제 그으 바블 멍너밥또 멍니더 그엉	방에 와 가지고 인제상그 인제 이 제관들끼리 일가친척 또 뭐 그날 참석했던 분들 모두 앉아 가지고 음복을 하고 하고 인제 그 어어 밥을 먹 밥도 먹습니다 그
밥또 인제 메 제사을 지나쓰이께네 밥 쁘 인제 이그 그글 은제 제사빠비라 그랭이다	밥도 인제 메 제사를 지냈으니까 밥 인제 이 그것을 인제 제삿밥이라 그럽니다
제사빠비 여언 안동에 가먼 허쩨사바비라구 파니더	제삿밥이 여기 안동에가면 헛제사밥이라고 팝니다
그기 마시 이써요 그이 머어 보옴뇨	그게 맛이 있어요 그게 먹어 보면요
그래가주 구 머 제사빰 머그러 간다 그고 모도 크으랜니더 웨	그래서 그뭐 제삿밥 먹으러 간다 그러고 모두 그랬습니다 왜
으 그르꼬이 인제으 술로 음보글 하고	어 그렇고 인제 술로 음복을 하고
그 인제 이 그 수럴 몸 머엉 사럼더 글때능 그응 음복 쑤른 쪼꿈식 핸니더웨	그 인제 이 술을 못 먹는 사람도 그때는 그 음복 술은 조금씩 했습니다 왜
웨 그른나 하고 잉 그 귀가 발가진다 그래 가주고	왜 그러냐 하면 이 그귀가 밝아진다 그래 가지고
그래 가즈어 음복 수런 몸 멍 수리라도마 찝 찌 쪼끔심 모두 다 머건니더 웨요	그래 가지고 음복 술은 못 먹는 술이라도뭐 조 조 조금씩 모두다 먹었어요 왜요
그다으미 그 혹씨 인제쓰 문중이나 동네마다 또 다 다른데 지베 지영마다 쪼옴씩 다르고	그 다음에 그 혹시 인제저 문중이나 동네마다 또 다 다른데 집에 지역마다 조금씩 다르고
예 예에 그 가가예무이락 거이 달라요	예예 그 가가예문이라고 거의 달라요
또까찐 아느	똑같진 않아
이 지역에스너 혹시 어르신 그거 제사상에 올리지 아는 올리집 올리면 안데는 그런 머 엄식뜰 까틍 거 이씀미까	이 지역에서는 혹시 어르신 그것 제사상에 올리는 않는 올리지 올리면 안 되는 그런 뭐 음식들 같은 게 있습니까
이찌에요	있지요
어뜽 게 쪼곰	어떤 게 조금
그으 공치 거틍 거 치 짜 드능 거늠 모 당에	그 꽁치 같은 것 치 자 들어가는 것은 못 해요
칼치 공치 이 이거늠 모 돌린니더	갈치 꽁치 이 이것은 못 올립니다
그다으메 혹씨 그으 먿떡 까틍 거또떡께늠 머 모 돌링 그렁 건 업쓰미꺼	그 다음에 혹시 그 뭐떡 같은 것도떡에는 뭐 못 올리는 그런 것은 없습니까
어물만 그러씀미까	어물만 그렇습니까
떠근 거이 떵에음 머어 굳 떠근능이응 고 공시기께느	예 떡은거의 떡 뭐 그 떡은응 공 공식이니까
그엄 머 쩜 므 찰떡 펴음 머 인절 므어 참 머 먿 펴엉 거 시루떡 송편이 떠건 거이 다 써요	그 뭐 저 뭐 찰떡 편 뭐 인절미 뭐 참 뭐 뭐 편 그 시루떡 송편 이 떡은 거의 다 써요
으언 므어 올리능 게으 워으 어으꼬 그 인제 에 치 짜 등 거느 인자 칼치 공치 이이거는 제사에 안 쓰따 그랩띠다	이것은 뭐 올리는 게없고 그 인제치 자 들어가는 것은 인제 갈치 꽁치 이것은 제사에 안 썼다고 그러던데요
여김 머 여어 여기는 똠 머 해삼물 중에서 빠져서느 안 데능 거넌 조기하고 고등언느	여기 뭐 여기 여기는 또 뭐 해산물 중에서 빠져서는 안 되는 것은조기하고 고등어는  예아 반다시 써에 데고 그언뇨반드시 써야 되고 그것은요
머 다릉 거늠 머	뭐 다른 것은 뭐
이 쩌 엠 명태하꽁	이 저명태하고
명태포우 그그늠 반다시 써이 데고요	명태포 그것은 반드시 써야 되고요
기 웨에늠 머 실과도 그래요 요샘 머 쉴가 므어탄 잔 지베 감 마구 마이올리 론데 옌나련 삼실과라 그르써요	그 외에는 뭐 실과도 그래요 요새는 뭐실과 무엇한 집 집에 가면 마구 많이 올려 놓는데 옛날에는 삼실과라 그랬어요
감 밤 대추	감 밤 대추
구어 삼실과라 그그덩	그것을 삼실과라 그러거든
요새 또 구으게으인제배 배 사과가 또 드가여 이시	요새 또 그게이제배 배 사과가 또 들어가요 이
조율이시라꼬 언제 그 그걸 인제 쓰고 그런데 고 기 웨에늠 머 써도 데거안 써드 데여 그금 머	조율이시라고 인제 그 그것을 인제 쓰고 그러는데 그 그외에는 뭐 써도 되고 안 써도 돼요 그것은 뭐
그다여 혹씨 제사 지낸능 게 예전하고 어르신 예저네 절머쓸 때하고 요즘므 제사 지내는 풍습 제사 풍습또 쫌 바껴씀미까 어떠쓰미까	그 다음에 혹시제사 지내는 게 예전하고 어르신 예전에 젊었을 때하고 요즘 제사 지내는 풍습 제사 풍습도 좀 바꼈습니까 어떻습니까
아이 마이 달려저쩨용	아이 많이 달라졌지요
마이 달릉 거 아이래 머 거이 머 이 천지개벼칸 셈이지 머에	많이 달라진게 아니라 뭐 거의 뭐 이 천지개벽한 셈이지 뭐요
옌나레는 기제산나리 다옴 어른 제사거 데뜨 조부 제사거 다오먼 참 정보글 하니드	옛날에는 기제사날이 다가오면 어른 제사가 됐든 조부 제사가 다가오  면 참 정복을 합니다
정보기라응 게 에에 함보글 이꼬 둘매이를 이꼬 그 우에 도포를 이꼬오어어 가설 쓰고 크래가주 인제 이 정 으응 정자참 정보글 하 하 하고설랑 그 저 으저 시니 아페 가서 지 저를 한데 요새는 이히 이븐 데르 항 그	정복이라는 게한복을 입고 두루마기를 입고 그 위에 도포를 입고갓을 쓰고 그래서 인제 이 정 응 정장참 정복을 하 하 하고설랑 그 저 저 신위 앞에 가서 절 절을 하는데 요새는 입 입은 대로 하는 거야
그게 인제 카나이 영 천지개벼기 데 쁘레꼬요	그게 이제 하나의 영 천지개벽이 돼 버렸고요
끄래 요새드 인제 그 저어 불처니 거튼 데 지낸 데늠 머 아주 제사 앋 제제과니 마이 모에고 그음 문중 제사 거튼 데는 그 이그 다 이 이꼬 지내지마는 기제사 거튼 데은 고에 추어로 고마 으 그르이 민는다 그게게찌 속따메말하멀	그래 요새도 인제 그 저 불천위 같은 데 지내는 데는 뭐 아주 제사제제관이 많이 모이고 그 문중 제사 같은 데는 그 이것 다 이 입고 지내지만은 기제사 같은 데는 그 주로 그만그러니 믿는다 그것이겠지 속담으로 말하면
아이 머 아부지한떼 머 므어 으으응 안 이붐 어떨라우 그래짜일러 그 그른 시기 데 잔나 하는 세기 데에 그	아이 뭐 아버지한테 뭐 뭐 응 안 입으면어떻겠어 그렇지 않나 그 그런 식이 되지 않나 하는 식이 돼요 그런
그리 요쌘느 영 응으하는 데돔 이쩨유 머탄 지베는	그래 요새는 영응하는 데도 있지요 무엇한 집에서는
좀 유유한 지베는	좀 유유한 집에서는
유유한 녀 풍조칸 지베는 그 맹 정보글 한 사름똥 이써요	유유한 집 풍족한 집에서는 그 역시 정복을 하는 사람도 있어요
조서언네드 이꼬 둘매이 이꼬 맹 도포 이꼬 갇 쓰고 그래 지내엔 집또이찌믄 기 웨 보편쩌그로 바서능 거이 다 고망 그날 으여 이 이 응 이버뜬대로 고마 우 우아끼나 관다 덜쳐 이꼬 고마 그래 제사 지내구 그래지 머	한복 입고 두루마기 입고 역시 도포 입고 갓 쓰고 그래 지내는 집도 있지만그 외에 보편적으로 봐서는 거의 다 그만 그날이 이 응 입었던 대로 그만 윗 윗옷이나 하나 걸쳐 입고 그만 그래 제사 지내고 그러지 뭐
그게 인제 천지개벼기 데텅 그헤	그게 이제 천지개벽이 됐다는 그게
며 옵 복짱이나 이렁 거또 차이 나고 머 혹시 제사 지널 시가니나 이렁거뚜 쫌 다	뭐 옷 복장이나 이런 것도 차이 나고 뭐 혹시 제사 지내는 시간이나이런 것도 좀 다
시가니 그케윽 그 그거또 천지개벼기래요	시간이 그러게 그 그것도 천지개벽이에요
요새믄 어쩐냐 꺼뜨머이 옌나려 안 열뚜 시 한 사이 지낸니더	요새는 어떠냐 할 것 같으면 옛날에는 한 열 두시 한 시 사이에 지냈어요
예를 드러 오느리윽 그르이 치뤌 시비 일 랄짜를 그게 떼먼 주근 사러임 오늘 시비 일 주거씨먼 사 어이 시비 일 꺼여 오후 오저네으 차이가 나오구더여	예를 들어 오늘이어 그러니 칠월 십이 일 날짜라 그러게 되면 죽은 사람이 오늘 십이 일에 죽었으면 십십이 일 그 오후 오전으로 차이가 나거든요
오저네 주거씨믄 십싸 미럴 제사을 지내이 데 새벼기 지내이 데고 시비 릴랄 주어쓰먼 시비 일랄기 열뚜 시 한 시 싸이읻 지나이 덴데 요새능 그거상관 업시 오늘 시비 일랄 도러가씸 시비 일랄 초저녀이 고마 일곱 시 여덜 지 뎀 제사 지내으	오전에 죽었으면 십삼 일에 제사를 지내야 돼 새벽에 지내야 되고 십일 일에 죽었으면 십이 일에그 열두 시 한 시 사이에 지내야 되는데 요새는 그것과 상관 없이 오늘 십이 일에 돌아가셨으면 십이 일 초저녁에 그만 일곱시 여덟 시 되면 제사 지내요
그게 인제 여게도 그런 풍서비 데 쁘러서 인저 스꽈니	그게 인제 여기에도그런 풍습이 돼 버렸어 인제 습관이
웨냐 점부가 절믐 분드리 도시스 사다 마래요 또 도시서 성장해꼬 커릉걸 포 장코 드또 보도 모 탄 이 이를 하자 그이께네 어으 어정쩡하고 하이께네고마 이게 간소화한다 그능 거 고마	왜냐 전부가 젊은 분들이 도시에서 살다가 말이에요 또 도시에서 성장했고 그런 것을 보지 않고 듣도 보도 못 한 일 일을하자 그러니까어정쩡하고 하니까 그만 이게 간소화한다고 그러는 거야 그만
그래가주 시비 일랄 아부지 기제상 고마 시비 일랄 쩌엗 저녁 끼응 일곱 씨에 제살 쩌이 여덜 씨 제사 찌내고 고마 저녁 겸 때아 쁘려요	그래서 십이 일에 아버지 기제사는 그만 십이 일 저 저녁 그 일곱 시에 제사를 지내고 여덟 시 제사 지내고 그만 저녁 겸으로 때워 버러요
으 저녀게 곰머 제사 지내 쁘이께네 머 그래 으 다 데 쁘이께네 그 그르이 머펼리하지으	어 저녁에 그만 제사 지내 버리니까 뭐 그래다 돼 버리니까 그 그러니 뭐편리하지요
그게 펼리하긴 머 옹 움 무 망고 펼리하지여 그르 옌날 대애먼	그게 편리하기는 뭐어 뭐 만고 편리하지요 그것을 옛날에 대면
그게 인제 참 마이 달러져쩨 머	그게 인제 참 많이 달라졌지 뭐
영 백팔씹 또 달러징 게러여	영 백팔십 도 달라진 거에요
거영 어째뜯 마봄며넌 예전하고 요즘 머 사 업 펴에 제사도 그러코장네도 그러코 사라 인는 사람들 편한 쪼그로 마니 가지	그러 어쨌든 뭐 어보면은 예전하고 요즘 뭐 살편 제사도 그러고 장례도 그렇고 살아있는 사람들편한 쪽으로 많이 가지요
이 즈 점부걷 자기 지 자기 주자 이이 즈 주이에이 참 에 편한 쪼그로 쫌 할라 그래 머더	예 이 저 전부가 자기 저 자기 주장 이 저 주의 참어 편한 쪽으로 좀 하려고 그래 모두
또 그 너무 에르께 하 꺼 머 인나 그런 식 데꼬 또요	또 그 너무 어렵게할 것 뭐 있나 그런 식이 됐고 또요
머 거이 거이 인지 요즈어멈 머 자기 편한 시그로 할라 한다 그지예	뭐거의 거의 이제 요즘은 뭐 자기 편한 식으로 하려고 한다 그렇지요
느그 그르체요	예 그렇지요 예
어르신 그 머 어제 이어서 쫌 이야기를 쫌 해 주십씨요	어르신 그 뭐 어제 이어서 좀 이야기를 좀 해 주십시오
예아	예
어제 우리 논농사에 대해서 이야기를 쫌 하션는데 그 그래서 오느릉 그 반농사에 대해스도 쪼곰 어이씨너 어르싱께서 아시는 대로 쪼금 이야기를 해 주시면 조케씀미다	어제 우리 논농사에 대해서 이야기를 좀 하셨는데 그 그래서 오늘은 그 밭농사에 대해서 조금 어르신 어르신께서 아시는 대로 조금 이야기르 해 주시면 좋겠습니다
그래습어제 급 반농사어너 주로 어떵 게 인는지 여기 진능 반농사가	그래서어제 그 밭농사는 주로 어떤 게 있는지 여기 짓는 밭농사가
여게 이 지여게는 주로 인제 머어 참언제 콩 보리 서숙 밀 또 그다으멘 인제 고구마 그래 크 이 이 찌 요중 간 인제 한 며 태 쩐부튼 저넨 녀땅꽁을 안 해은데 한 해방 후 한 오륭 년 은 은 저우 후버트먼 여 땅콩도 한다꼬요	여기에 이 지역에는 주로 인제 뭐 참인제 콩 보리 조 밀 또 그 다음에는 인제 고구마 그래 그 이 이 저 요즘 와서 인제 한 몇 해 전부터 전에는 여기 땅콩을 안 했는데 한 행방 후 한 오륙 년어 저 후부터는 여기 땅콩도 한다고요
딷 땅콩도 지이꼬 극 극 끄 감자 주로 그릉 게 웨 반농사른녜	땅 땅콩도짓고 그 그 그 감자 주로 그런 게 왜 밭농사는요
그언너 거기 그 반농사 논농사에 비해섭 그어 반농사 하는데에 여기선너주로 그럼 제일 마니 하능 겝 버리하고	그러면 거기 그 밭농사 논농사에 비해서 그 밭농사 하는데 여기서는 주로 그럼 제일 많이 하는 게 보리하고
감자지 머	감자지 뭐
버리하우 감자가 만씀미까	보리하고 감자가 많습니까
글치여우 고담 콩이고	그렇지요 그 다음이 콩이고
쁘어 버리느 그람머 언제 주로 심꼬 어떠케 함미까	보 보리는 그러면 언제 주로 심고 어떻게 합니까
버리느 인제으 갈버리라 그능 거능 긍 으 참 쩌어 그 갈버리라 그응가을게 감니자 나락 비 네구 추수하고	보리는 인제어 가을보리라 그러는것은 그참 저 그 가을보리라 그러는 것은 가을에 갑니다 벼를 베 내고 추수하고
크렴 인제 언능 그 나락 뜽거리 인는 쓰 새에다 인제 수루루 후끼로 가음상타 뿌고 타 뿌고설랑 거게 버릴 뿌래고 그 저어 그 써레라 그능 녀 까주어이래 드 소에 메 가여 땡기고 나오 와따 가따 그러 뿌먼 그 버리가 무챔니다	그러면 인제그 벼 묶음이 있는 사이 사이에다가 인제 수루룩 쟁기로 가면서타 버리고 타 버리고서는 거기에 보리를 뿌리고 그 저 그 써레라고 그러는 것을 가  지고 이래 저 소에 메 가지고 당기고 나오며 왔다 갔다 그래 버리면 그 보리가 묻힙니다
커려 음제읍 고 사이다 인제 고러 사람 댕길 고 고를 쥐이 노코 그래가주인제 나 두먼 내염 보메 까 이지야 저 지 느점믄능 가을게 가믕 그 싸기 틈니다	그러면 인제 그 사이에다가 인제 골 사람 다닐 골 골을 지어 놓고 그래서 인제 놓아 두면 내년 봄에 그 이 저 저 늦은 가을에 가면 그 싹이 틉니다
싸기 터 가지 이래 조와 오르믄 추울 때 가먼 한 송꾸락 한 기리택 뗌다버리가 조응 게	싹이 터 가지고 이래 좋게 오르면 추울 때 가면 한 손가락 한 길이쯤 됩니다 보리가 좋은 게
그릉 게 인제 파랑 게 나와 이씸믕 그게 기여를 람니다	그런 게 인제 파란게 나와 있으면 그게 겨울을 납니다
기여를 람믕 보메 인제 또 그넘머 그이 보메 거 인제 이 시비라 그능 이 여인제에 비료라 그능 게 이씨다	겨울을 나면 봄에 인제 또 그러면 그게 봄에 그인제 이 시비라 그러는 게 여기 인제 비료라 그러는 게 있습니다
요샘 은지 이 옌나레능 머 똥짱구이 지곰 마리야 오줌하콩 이래 가주이즏지고 이 뎅기민썽 인제 쪼꿈씨 쫑우섭 뿌래 주고 핸데 요새에능 그거느 인제요굼머 숙 저 뿌고 비료럴 가주 인제 야깐씨 조 노씀다	요새는 인제 이 옛날에는 뭐 똥장군을 지고 말이야 오줌하고 이래 가지고 지고 이 다니면서 인제 조금씩 조금씩 뿌려 주고 했는데 요새는 그것은 인제 그만 싹 져 버리고 비료를 가지고 인제약간씩 줘 놓습니다
주 쭈 조 노코 인제 또 고다으메 인제 어아 봄뻐리러응 게 또 이씀미다	줘 줘 줘 놓고 인제 또 그다음에 인제봄보리라는 게 또 있습니다
봄뻐래르 그응 근 보메 기열 라고 봄 한 양녀 칸능 음냐 칸 사멀 리 양녀 칸 사월 사월경 므 데 가주 인제 버리를 감니다	봄보리라 그러는 것은 봄에 겨울 나고 봄 한 양력 한 음력 한 삼월 이 양력 한 사월 사월경에 뭐 돼 가지고 인제 보리를 갑니다
보메 가라 그은깐	봄에 갈아 그러니까
바테도 가고 노네도 가고 다 가는데 그 인제 그 그 봄뻐리는 쌀버리가또 이꼬 주로 쌀버이르 그응 그느 훼기가 적씁니다	밭에도 갈고 논에도 갈고다 가는데 그 인제 그 그 봄보리는 쌀보리가 또 있고 주로 쌀보리라 그러는 것은홰기가 적습니다
요래 인제 껍떼이거 똥뚜안 나오고 인저 쌀버리두 하고 껍버리드 하고	요래 인제 껍질이 똥글똥글하게 나오고 인제 쌀보리도 하고 겉보리도 하고
그래 인제 맹 갈버리도 맹 꺼뻐리 봄뻐리 함니다	그래 인제 역시 가을보리도 역시 겉보리 봄보리 합니다
그래 똑까지여그 그걷 추 추수하고 그담메 응 감자라 근 거는 양녀 칸 사멀 응 그 그으또 맹 마치여 사월 초생쭘 데머 인제 바철 갈고 고를 타고거 인제 이으 거르멀 려콩 허래 가주이 요샌 비롤 쪼꿈시읍 꼬레 가 인제으 그감자씰 여어 가주고 인제 그 그느미 나멍 가꽈 가주고 그래 갇까 감자는 양녀기 유월 초순 치럴 초에 캠니다 그거너	그래 똑같이 그것 추 추수하고 그다음에 응 감자라고 그러는 것은 양력 한 삼월 응 그 그것도 역시 마찬가지로 사  월 초순쯤 되면 인제 밭을 갈고 골을 타고 그 인제 이 거름을 넣고 그래 가지고 요새는 비료를 조금씩 뿌려 가지고 인제 그 씨감자를 넣어 가지고 인제 그 그놈이 나면 가꿔 가지고 그래 가꿔 감자는 양력 유월 초순 칠월 초에 캡니다 그것은
캐가지 머꼬	캐서 먹고
버리도 역씨 유월 참 오월 초이 유월마릴경 데믄 이 팯 다 여 다여뭄니다	보리도 역시 유월참 오월 초유월말일경 되면 이 패고 다 여 다 여뭅니다
그래므 그으 가주쓰쪼에 인제 비 가주윧 추술 하고 거러 인제 거 콩이라 그능 거는 옌나레는 어이 요새느 인제 이 기양 콩을 고마	그러면 그것을 가지고인제 베 가지고 추수를 하고 그러고 인제 그 콩이라 그러는 것은 옛날에는요새는 이 그냥 콩을 그만
노지로 가는 데두여 노지라 그능 거 인저 받 전체 앙 꺼또 안 하고 콩먼가능 게 이써요	노지로 가는 데도 노지라 그러는 것은 인제 밭 전체에 아무것도안 하고 콩만 가는 게 있어요
그게 인제윽 그르코	그게 인제 그렇고
옌나레는 버리 감잘 으 인제 그 새애 꼬레다 그리라 그음상 인제 그 콩얼시머슴다	옛날에는 보리 감자를인제 그 사이 골에다 그리라 그러면서 인제그 콩을 심었습니다
소를 메아 호끼루 수루 타고 또 그르음 사라미 끌꼬 함 타고 거 여어가주은제 그 콩 으으흠 머로 버리 감자를 추수얼 한 디엔는 그 거랑을 또 탐니다	소에 메어서 쟁기로 쓱 타고 또 그 다음에 사람이 끌고 한 번 타고 거기 넣어 가지서 인제 그 콩뭐냐 보리 감자를 추수를 한 뒤에는 고랑을 또 탑니다
후끼로 타먼 그그 콩을 무더 줌다	쟁기로 타면 그 콩을 묻어 줍니다
이래이 야깐 무채머으 글티 사라미 감 호무로 이자 무씀니다	이래 약간 묻히면 그때 사람이 가면서 호미로 인제 묻습니다
무더가드 그 인제 가을게 추수하꼬 그르코	묻어서 그 인제 가을에 추수하고그렇고
서수건 또 인제 서숭 농사는 에 버리보다 초끔 느께 감니다	조는 또인제 조 농사는 에 보리보다 조금 늦게 갑니다
요즘 가아껴이 요즘 아이따 오월 한 금 저께 데먼 그 그거 역씨도 인제으 그리라 그꼬 인제 그 감자받 새에도 여꼬 버리받 새에도 여 맹 콩과 마차이래	요즘 갈 거야 요즘 아니다 오월 한 지금 정도 돼면 그 그것 역시도 인제 그리라 그러고 인제 그 감자밭 사이에도 넣고 보리밭 사이에도 넣는 역시 콩과 마찬가지야
그래으 그리라꺼 그 탕을 여어 가주고 그으 가을게즈 추수하능 게고 그래가반농사느읻 주로 고마요	그렇게 그리라고 그 땅을 넣어 가지고 그 가을에 추수하는 것이고 그래서 밭농사는 주로 그만요
그람 그러가 여기느 혹시 미른해씀미까	그러면 그래서 여기는 혹씨 밀은 안 했습니까
여어도 미를 하인 옌나레 해써여 점뇨	여기도 밀을 하긴 옛날에 했어요 조금이요
요새엔 밀함니다 여느	요새는 밀 안 합니다 여기는
미리 잘 안 데 또 요새엔뇨	예 밀이 잘 안 돼 또 요새는요
여이	아 여기
저으	저 예
이 끄이 기후가 웨 변도이 생기니 여언 미른 쪼끔 정 거치 안 데드라꼬	이 그 기후가 왜 변동이 생겼는지 여기는 밀은 조금 전 같이 안 되더라고
