dialect	standard
허러 인저 그거 머응 사랑도 이꼬 기양 곰 암 머꼬 고다나이 꼼머 자는 사람드 이꼬 그르트락 구게 인제	그래 인제 그것을 먹는 사람도 있고 그냥 그만안 먹고 고단하니 그만 자는 사람도 있고 그렇더라고 그게 인제
거윽 그애서 어째뜬 그래가 머 천날빰 그어 한다 그지예	그 그래서 어쨌든그래서 뭐 첫날밤 그래 한다 그렇지요
끄 보통 그 인제 그얻 은저 그륻때 인제어 초레 에 그 하고 그럼며너 인제머 아까두 이야기해찜마는 무근 신행 하는 사얌머 실랑이 머 처가찌베서 무꼬어 지내다가 또 머 가끔 자기 집 봉가에 가따가	그 보통 그 이제 그 이제 그때이제 초레그렇게 하고 그러면은 이제 뭐 아까도 이야기했지만은 묵은 신행 하는 사람은 신랑이 뭐 처갓집에서 묵고지내다가 또 뭐 가끔 자기 집 본가에 갔다가
따가 또 오구오 그러 쑤도	갔다가 또 오고 그럴 수도
와따 가따 하음면서 그래서나중에 인제결과저그로 인제 무근 신행 끈날 무려베	왔다 갔다 하면서 그래서나중에 인제결과적으로 인제묵은 신행 끝날 무렵에
그키 양가이 타압패가주 인제 신행을 해가쭈 그만	그래 양가에서 타합해서인제 신행을 해서 그만
그르쪼 신행을 가며 인제 여자 입짱에서넌 시집까능 거 아임미까 그지에입짜이	그렇지요 신행을 가면 인제 여자 입장에서는 시집가는 것 아닙니까 그렇지요 입장이
그어 그 그르찌여 여자저이 여자로튼 실랑 찌베 가능 게고	그 그 그렇지요 여자 여자로서는 신랑 집에 가는 것이고
그르치예	그렇지요
네에 인제 결구은 시집가능 건데 시집까서 인제 에어 저쭈게 인제 저쪼게어 실랑 찌베 인제 시집까서넝 거이서늠 머 잔 잔치만 하지 머 아까처럼 머 홀레 치르고 인제 이릉 건 업따 아님미까 그지에	예 인제 결국은 시집가는 것인데 시집가서 인제저쪽에 인제 저쪽에 신랑 집에 인제 시집가서는 거기에서는뭐 잔 잔치만 하지 뭐 아까처럼 뭐 혼례치르고 인제 이런 것은 없다 아닙니까 그렇지요
그러치요 그 신행 찌베는 끄으 머 잔치 케양 머꼬 엉 에 머꼬 심부 보러 오  지 머 다릉 건	그렇지요 그 신행 집에는 그 뭐 잔치 그냥 먹고에 먹고 신부보러 오지 뭐 다른 것은
남자드른느 벨러 안 온다 그이께네 어이 거 신행 찌베는 여자드리 주로와 고마	남자들은 별로 안 온다 그러니까그 신행 집에는 여자들이 주로와 그만
아이 지여 새득 뽀로 온다 그래 새득	어 저 새댁 보러 온다고 그래 새댁
심부를 새드기라 그래그더 여	신부를 새댁이라 그러거든 여기에서는
요 구경하러 머 잘젇 잘난나 몬나나 보로 온다 그르고 머 그래가주 주로인제 친척 남자더른 친척 웨에는나이	요기 구경하러 뭐 잘 잘났나 못났나보러 온다 그러고 뭐 그래서 주로 인제 친척 남자들은 친척 외에는 안 와요
끄엄며너 그워 페배글 그때 함미까	그러면은 그 폐백을 그때 합니까
페배기라 거능 게 인제 신행 가 가주고여자가 인제 샤할랑 찌베 신행을라꺼 갈 때 으 페배기라 그능 걸 멀 장만해가주 간다궈	폐백이라 그러는 게인제 신행 가 가지고여자가 인제 신랑 집에 신행을 갈 때폐백이라 그러는 것을 뭘 장만해서 간다고
달또 이꼬 머 머 고기도 이꼬 머 머 밤도 이꼬 대추도 이꼬 그릉 걸 싸 가주고 이래 쟁바네 싸 가주고 응 그 가마 여어가주 우어이 씨래이 신행어르카 가믄 신행을 드려닥 어여 그 가믄 응 그 시어른는 시부모한떼음 인사을 드랜다꼬	닭도 있고 뭐 뭐 고기도 있고 뭐 뭐 밤도 있고 대추도 있고 그런 것을 싸가지고 이래 쟁반에 싸 가지고그 가마에 넣어서신행 신행을 가 가면 신행을 들여다그 가면그 시어른 시부모한테 인사를 드린다고
그게 페배기라 그드라꼬 보이께네	그게 폐백이라 그러더라고 보니까
그래 심부가 아아이 썌이 시어른 양어분한떼 제이 저럴 하고 그 페배글 내노으먼 그 요새로 말허꺼 바밈 대추 거틍 거를 떤져 주문상은 머 어언 참 은어 으응 마낸 아드를 로으란 시그로흥 그래 힌제으 머 무루페 떤져 주드라꼬그른 녜게 인제 그게 페백 드랜다 그드라꼬	그래 신부가시 시어른 양어른한테 절 절을 하고 그 폐백을 내 놓으면 그 요새로 말할 것 같으면 밤이며 대추같은 것을 던져 주면서 뭐참어많은 아들을 놓으라는 식으로 그래 인제뭐 무릎에 던져 주더라고 그런 예가 인제 그게 폐백 드린다고 그러더라고
그게 인제버 에이 요새로우 글때능 그게 페배기라 그래드라꼬요	그게 인제어 요새로 그때는 그게 폐백이라 그러더라고요
그암 페배 그으게 인제 악 페배글 그때 머 신행 와서 페백할 때 보통 시으실랑 시부모맘 페백 뽐미까 앙 그암 머 페백 어디까지 봄미까 보통	그러면폐백 그게 인제 아까 폐백을 그때 뭐 신행 와서 폐백할 때 보통 신 신랑 시부모만폐백 봅니까 안 그러면 뭐 폐백 어디까지 봅니까 보통
폐배기 그르이껜 인제으 그윽 큰 응 그이 자기 실랑 지베아 머 구오우 그거인제 맹 가차운 친처긍 어름분더드어런 마쩌를 하고 보긴 보드라꼬	폐백이 그러니까 인제 그 큰그 자기 신랑 집에 뭐 그 그것 인제 역시 가까운 칙척 어른분들은 맞절을 하고 보기는 보더라고
그 마쩔 하드라꼬	어 그 맞절 하더라고
마쩔 하거우 보드라꼬 그	맞절 하고 보더라고 그
글때 으 그거 맹 그제거끄 그거 노꼬 맹 저를 하드라꼬옹	그때그것 역시 그것 그것을 놓고 역시 절을 하더라고
페배 그걸 로꼬	폐백 그것을 놓고
머 수를 한 잔 올리고 그래 함	뭐 술을 한 잔 올리고 그래 합니까
으예	예예
긍 그래등 거 타꼬	그 그랬던 것 같다고 예
확씨리 멀 므어 그 다 이저 뿌래 인제 아허으 그르치 십따꼬 인제이 기어기 나능 게	확실히 뭐 뭐 그 다 잊어 버리고 인제 허허 그렇지 싶다고 인제 기억이 나는 게
그래 인제 그 시어른 외에 가차운 머 삼촌이라든지 사초어니라든지 이른 사람드릉 그거 마쩌르 하고 보드라꼬 마디	그래 인제 그 시어른 외에 가까운 뭐 삼촌이라든지 사촌이라든지 이런 사람들은 그것 맞절을 하고 보더라고 말이지
철 첟이인사라꺼 그으래뜨라꼬	첫 첫인사라고 그러더라고
그때 처음 인제심부 입짱에서느 그때 인제아 지반 어른들 처음 벱찌예	그때 처음 인제신부 입장에서는 그때 인제 집안 어른들 처음 뵙지요
그래 잉 그 으어 그아 저이 인살 드래능 게비 거	그래 이 그그 저 인사를 드리는 것이지 그
그다은 그다으메 시 거음 시부모 중에서 머 시아버지너 초레 땝즈 그엄 뻐 봐 초레 하는 날 볼 수 보 숨	그 다음 그 다음에 시 그 시부모 중에서뭐 시아버지는 초례 때저 그 봐 봐 초례 하는 날 볼 수 볼 수 있습니까
아이래에영	아니에요
그때도 모 뽐미까	그때도 못 봅니까
그얼롱음 모 빠찌	그때는 못 봤지
도 그영 어째뜬 처음 벰능 거는	뭐 그럼 어쨌든 처음 뵙는 것은
어예 그날 페백 드랜 날 보지	예 그날 폐백 드린 날 보지
신행 와서	신행 와서
그 페백 뜨린 날오 확씨리 보지요	그 폐백 드린 날 확실히 보지요
시어머니늠 므 처어 처음 인사 드리능 거우   그지예	시어머니는뭐 처음 처음 인사 드리는 것이고   그렇지요
예아	예 예
웨아 그르스 그 하고그다으메으 인제 보통 그거 신행 옴며너 여자들한테 거 새댁한테 상을 주지예	예 그래서 그렇게 하고그다음에 인제 보통 그것 신행 오면은 여자들한테 그 새댁한테 상을 주지요
상을 인제 그	예 상을 인제 그
그 상은 무슨 상이라 함미까	그 상은 무슨 상이라 합니까
그게 어여 으 이 큰사이라 그랜너이 큰사아	그게어 이 큰상이라 그랬습니다 큰상
큰사이라 하지예	큰상이라 하지요
큰상에너  어뜨게 함미까	큰상에는  어떻게 합니까
꺼으 끄 큰상을 바더	그 그 큰상을 받아서
큰상을 저럴 하능 게 아이고	큰상을 절을 하는 게 아니고
머 큰상에 멀 차려 줌미까 보통	뭐 큰상에 무엇을 차려 줍니까 보통
그르이 머 그게 옌날로 말하 꺼 머 머이 칠첩 방상기니 머 머 에듬 메 처꺼반상기 그므썬 그 쩌에 그 머아 바네 노엔 수짜를 인제 젱으 그 접씨가 일고 껨칠처비거고 머 쎼이 열 깸 십처비래 그 그릉 꺼 테 보이께네	그러니 뭐 그게옛날로 말할 것 같으면 뭐 뭐 칠첩 반상기니 뭐 뭐 이 몇 첩 반상기 그러면서 그저 그 뭐 반에 놓인 숫자를 인제 접 그 접시가 일곱 개면 칠첩이고 뭐 십 열 개면십첩이라고 그러고 그런 것 같아 보니까
그어 칠첩 반상기에다 음시글 여래 채리 가주어 밥바꼬 가따 노으먼 큰상을인제 그으 거 가차운 친처기에 가따 주먼 그 새드기 그걸멍는다꼬	그 칠첩반상기에다 음식을 요래 차려 가지고 밥하고 갖다 놓으면 큰상을 인제 그 그 가까운친척이 갖다 주면 그 새댁이 그것을먹는다고
그걸 인제 신행 와가주 인제 처 쌍 큰사이라 그래드라꼬	그것을 인제 신행와서 인제 첫 상 큰상이라 그러더라고
그아임 보통 큰상 그거 은제 심부가 와서 큰상얼 바더 가주고처음 바블 멍는데 그아므 그어때 그냥 여자어가 시음부갇 직쩝 자기 이베 먼젇 떠러씀미까 앙 그암 다른 사암한테 누구 줌미까	그러면 보통 큰상 그것 인제 신부가와서 큰상을 받아 가지고처음 밥을 먹는데 그러면 그때 그냥 여자가 신부가 직접 자기 입에 먼저 떠넣습니까 안 그러면 다른 사람한테 누구 줍니까
아이래 그게 옌나레름 마르지예	아니야 그게 옛날에는 말이지요
에 옌날얼러므	예옛날에는요
얼 그 잘산이 옌날 얘기레예이	어 그 잘사는이 옛날 얘기에요
예 옌날 꺼 하무 요즘 안 하니카	예옛날 것 하시면 요즘 안 하니까
잘사는 잘 지베는 그게 어이 시 신행얼륵 갈 찌게 그 어으 그 시녀를 데루가여 하나	잘사는 잘 집에는 그게신 신행을 갈 적에 그그 시녀를 데리고 가요 하나
시녀럴	시녀를
자기 몸쫑을 데루 간다꼬	자기 몸종을 데리고 간다고
잘사는 지베는	잘사는 집에서는
그르치예 몸쫌에 함 명 데르 가지예	그렇지요 몸종을 한 명 데리고 가지요
어 몸쫑을 처녀래 그또	어몸종을 처녀야 그것도
데리구 가먼 그 이드 몸쫑익 거게서 인제 바벌 떠메기 준다꼬 그 큰상을 바드마	데리고 가면 그 이 몸종이 거기에서 인제 밥을 떠먹여 준다고 그 큰상을 받으면
그 몸쫑이 그 인제보잘 해 준다꼬	그 몸종이 그 인제보좌를 해 준다고
어에 하라꼬 밥또 떠미게 주고 마리지여 오또 이래으 가사 주고 마리지 이르 인제 에 그 시녀를 데루 가 가주고 몸쫑을 데루 가서 그어으 보졸 반는 집또 이꼬 몸쫑이 엄는 지베느 여뻬 가차운 지베서 머 한 술 떠미게 주고 그른  녜드 임 머	어떻게 하라고 밥도 떠먹여 주고 말이지 옷도 이래 발라 주고 말이지이래 인제그 시녀를 데리고 가 가지고 몸종을 데리고 가서 그 보조를 받는 집도있고 몸종이 없는 집에는 옆에 가까운 집에서 뭐 한 술 떠멱여 주고 그런 예도 있는 모양입니다
그르쵸 어딤 머 하능미나 머 이런 시우러 데리우 가지영	그렇지요 어디 뭐하인이나 뭐 이런 식으로 데리고 가지요
야예아예 예어 그 그래	예예예그 그래
그엄믄 그 웨감 므 가서 저를 해야 데니까 으에 또 절도 해야 데고 쯔어	그러면 그 왜 뭐 가서 절을 해야 되니까또 절도 해야 되고 저
그 그읻 저리랑 게 그케 거 인제 저 이	아 그 그 절이라는 게 그러게 그인제 저 이
시부모 페백 뽈라 함며너	시부모 폐백 보려 하면은
시여 씨부모 페백 드렬 찌이 저럭 큰저를 다 하능 게라	아 시 시부모폐백 드릴 적에 절을 큰절을 다 하는 거야
그르쳐 여자 혼자는	그렇지요 여자 혼자는
끄어 그 가차운 친척 다 대렐 다 하능 게라 글때느	그 그 가까운 친척 다대례를 다 하는 거야 그때는
그르치예	그렇지요
인살 라눙 게라	인사를 나누는 거야
여자 혼자 절하 남자느 혼자 머 절하기 쉬운데 여자너	여자 혼자 절하기는 남자는 혼자 뭐 절하기 쉬운데 여자는
여잔 여페서으 보조올 해 주제이	여자는 옆에서 보조를 해 주지
그얼치예 큰절하기가 힘드니까	그렇지요 큰절하기가 힘드니까
에예	아예
이 양짜어 부터가주 보조올 해 준다 꼬래 큰저얼 한 덴	이 양쪽에 붙어 가지고 보조를 해 준다고 그래 큰절을 할 때는
그엄며는 그때 머 그 보통 그 밥 까튼 경우에풍으이 이런 데너 풍스비머 땅 거 업씀미까	그러면은 그때 뭐 그 보통 그 밥 같은 경우에풍 이런 데는 풍습이 뭐 다른 게 없습니까
거어시작짜 시지베 와서 머 시누나 누구항그 누구한테 이거 머 밥 제일 한 술 제일 먼저 떠가지 누구한테 주라 그릉 건 업씀미까 이 동네에넝 그렁	그시집 시집에 와서 뭐 시누이나 누구한테 누구한테 이것 뭐 밥 제일 한술 제일 먼저 떠 가지고 누구한테 줘라 그런 것은 없습니까 이 동네에서는 그런
모르시더 그거는느 자시 모르겐데	모르겠습니다 그것은 자세히 모르겠는데
여자들 끼라서	여자들 것이라서
어예아	예
어르신 그음이여 어제 이어스 게속 하게씀니다	어르신 그러면이어서 어제 이어서 계속 하겠습니다
예예 그래시더 예예	예 그럽시다 예
어르신 어제 우리 그엄 이 마을 유래라든지 이럼 부부네 대해서 쫌슴 말쓰믈 해 주션는데 끄어혹씨 그 요즈므언 머 주로 어제도 잠시 이야기해쓰미다마는 장어 누가 도러가시게 데며느 초상나며너 점부 장이사라든지 병어 영안씨 병원 영안씨 가써 에여 마이 하처	어 어르신 어제 우리 그것 이 마을 유래라든지 이런 부분에 대해서 좀 말씀을 해 주셨는데 그혹시 그 요즘은 뭐 주로 어제도 잠시 이야기했습니다만은 장 누가 돌아가시게 되면은 초상나면은 전부장의사라든지 병 영안실 병원 영안실 가서많이 하지요
다 하져 요솜	다 하지요 요새는 예
예 하어게 데서 쪼곰 그르치마너 에전 가트며는 대개 지베서 안 해씀미까 거르치에	예하게 돼서 조금 그렇지만은 예전 같으면은 대개 집에서 안했습니까 그렇지요
예전 거트먼 은 지베서 마가 장미 장니 치루조	예 예전 같으면집에서 모두 장례 장례를 치르지요
혹씨 그얻 사라미이 이 주거서 장네를 치를 때에 쩌 이 자으 저 예저네 장네 치를 때 어떤 시으루 치런는지 함무 이야길 하문 해 주이소	혹시 그 사람이 이 죽어서 장례를 치를 때에 저 이 장례 저 예전에 장례 치를 때 어떤 식으로 치렀는지 한 번 이야기를 한 번 해 주십시오
요즘 머 사암들 잘 모르니까 에	요즘 뭐 사람들 잘 모르니까 예
옘 으예	옛예 예
이 옌날 에임 장레 치른 버블 얘기하까요	이 옛날장례 치르는 법을 얘기할까요
옌나레는 인제읍 부모가 머 편찬해 가주 상을 당하믄 상주가 그 문중 어른드리 모도 모에고 해서 그 인쩨 별쎄해따는 부고를 씀니다	옛날에는 인제 부모가뭐 편찮아 가지고 상을 당하면 상주가 그 문중 어른들이 모두 모이고 해서 그 인제별세했다는 부고를 씁니다
읍 부고를 인자 하모에 하모 임 머 이 유인내 그애 해 가주 그 으 부치니 어제 날짜로 마 인 메 시경에 이 경여 머 유씨므 유씨야 마 으 그른 씨로 해 아주이별쎄해쓰니께 자이 부고한닥 이래 인제 그 부골 내먼 그으 부골르 가주고 옌나레는 우체부가 업썬니더	그 부고를 인제 항목 항목 이 뭐 이 유인을 그 해 가지고 그부친이 어제 날짜로 뭐 이 몇 시경에 이 경에 뭐 유시면 유시 뭐 어그런 식으로 해 가지고 별세했으니까 아들이 부고한다 이래 인제 그 부고를 내면그 부고를 가지고 옛날에는 우체부가 없었어요
여에 동네 사럼드리 모도 한 동네쓰 마타 가즈어 이마꺼이 여나음 장씨에이  시무 장석 가주고 전낸니더 동네매동	여기 동네 사람들이 모두 한 동네씩 맡아가지고 이만큼씩 여남은 장씩 스무 장씩 가지고 전했어요 동네마다
가서 인제 집찜매동 가서 인제 이여 부골 전나고 끄으 그래 와 가주고 인저또 부골 전난 따으메으 그 사람드름 부고 전하도르 캔 노꼬 동네 문중 어른드른또 망이네 대한느 장이를 정해요	가서 인제 집집마다 가서 인제 이 부고를 전하고 그 그래 와 가지고 인제 또 부고를 전한 다음에는 그 사람들은 부고를 전하도록해 놓고 동네 문중 어른들은 또 망인에 대한 장의를 정해요
제 장이르이 예를 뜨러 가주 말하음 오늘 도러가씨미 요샌 먿 주로 사밀짜일니더 머 암 냐음 머 더도 모 타고 그래두구만	인제 장의를 예를 들어 가지고 말하면 오늘 돌아가시면 요새는 뭐 주로 삼일장입니다 뭐음 뭐 더도 못 하고 그러더구만
그느 옌나렌 머 사밀짱도 마이 해찌만 보통 오일짱 치릴짱 그래 머탄 지벤 머 어어 근 열흘 으을 보름장도 지낸 지비 이써써 유유한 지베는	그런데옛날에는 뭐 삼일장도 많이 했지만 보통 오일장 칠일장 그래 무엇한 집에는 뭐 어근 열흘보름장도 지내는 집이 있었어 여유있는 집에서는
그래어 황겨이 좀 느잉 경제가 나꼬 한 지베는	그래 환경이 좀 낫고 경제가낫고 한 집에서는
그래 장네을 채루코 그게 찌 장녀는 인제 쯔 에 그래 데먼 인제 지 에 상가에서는 인저 그 금 망이니 주근 다으메 인제 수으 소리미라 근능 어이 소려미라 그능 거 소려믈 하니더	그래 장례를 치르고 거기에 장 장례는 인제 저 어그래 되면 인제 저상가에서는 인제 그 그 망인이 죽은 다음에 인제 소 소렴이라 그러는 것 소렴이라 그러는 것 소렴을 합니다
소려미러 그능 거느 인제 망이널 인저 소늘 거다 가주 무꺼 조요	소렴이라고 그러는 것은 인제 망인을 인제 손을 거두어 가지고 묶어 줘요
마 발라꼬 거 이게	뭐 발하고 그 이게
그 이스 에 사라미랑 건 숨 떠러지먼 고마 사지가 구더 뿌거드요	그 이어 사람이라는 것은 숨이 떨어지면 그만 사지가 굳어 버리거든요
구더 뿌먼 소널 모치럴 모 하이께네 덜 구더슬 찌게 소널 모코 바를 마아가주 무끼 조트룩 배 우에 요래 은저 가주이 요골 소리미라 그래여	굳어 버리면 손을 모으지 못 하니까 덜 굳었을 적에 손을 모으고 발을 모아 가지고 묶기 좋도록 배 위에 요래 인제 가지고 요것을 소렴이라고 그래요
그래 소리믈 마치고 나머 인제 그나알 거트먼 그 인제으 상주는 머 그어를쩌꺼 성보기라 그은 또 제사알 지내요	그래 소렴을 마치고 나면 인제 그날 같으면 그 인제 상주는 뭐 그것을 저것 성복제라 그러는 또 제사를 지내요
성보글 지내먼 성복 쩌네는 다리이능 고글 모 태여 상주도	성복제를 지내면 성복제 전에는 다른 사람은 곡을 못 해요 상주도
으 성보기라 그능 거느 인제 머 어이 이트레머 오늘 주거씸므 내일쯤 성복 제사을 치이내요	그 성복제라 그러는 것은 인제 뭐이틀에뭐 오늘 죽었으면 내일쯤 성복 제사를 지내요
상복 제사러 그능 거느 인제 머펴늘 해 어으하고 머 그래 가주 인제 불각찌 성복 제사을 지내먼 성복 제사을 지냄 인저 상주는 상보글 이 이  버이 데요	성복 제사라고 그러는 것은 인제 뭐편을 해어 하고 뭐 그래가지고 인제 불 같이 성복 제사를 지내면 성복 제사를 지내면 인제 상주는 상복을입어야 입어야 돼요
상 베오스로 인제이 가라이이꼬 커래 가주우 그날브틈 인제으 고걸 해서 상주가	상 베옷으로 인제 갈아입고 그래 가지고 그날부터 인제 곡을 했어상주가
머이 사목 고글 모 타다가도 성보글 지내어 보글 이븐 다으메느 아이고러 그는 고글 해요	뭐이 사뭇 곡을 못 하다가도 성복제를 지내고 성복을 입은 다음에는 아이고라 그러는 곡을 해요
그래가주 인제 상문서 문상객뜨리 오먼 문상객뜨또 가치 인제 에 엠 맏재밸하고 이니 영위를 다니고 인저 상주한데 맏재배을 그 맏재배을 한데 인제 문상온 사람드른 초로 그 인제 므어 써 기양 절만 하기 쑥쑤로 하이께네 그 머 상고을 당애서 얼마나 으 앵 이 그 머 애서칸냐꼬 마이제 이른 시그로 인제 인사말씀 해요	그래서 인제 문상객 문상객들이 오면 문상객들도 같이 인제어 맞재배를 하고 이 영위를 다니고 인제 상주한테 맞재배를 그 맞재배를 하는데 인제문상 온 사람들은 주로 그 인제 뭐 쑥 그냥 절만 하기 쑥스러워 하니까 그 뭐 상을당해서 얼마나어 이 그 뭐 애석하냐고 말이지 이런 식으로 인제 인사 말씀을해요
그래 참 이미 이그 잉으 저부시에 상을 당애서 응우후 우옌냐코마육 그른 소리로도 인살 하고	그래 참 이 이 이 저불시에 상을 당해서어우 어떻게 하냐고 말이지 그런 소리로도 인사를 하고
그래 인제 상지를 치 치루먼 고다으민 인제 성복 지내먼 그 인제 그음 망이네 장녜 줌비를 해여	그래 인제 상례를 치 치르면 그 다음에는 인제 성복제를지내면 그 인제 그 망인의 장례 준비를 해요
오오 과늘 사 오고 관니라 그응 게 너리 말씨더 너를 가서 시자아 가서멈 머 이떠 옌나렌너 시장에 사 옹 거 이짠 보통 지베 노코 해써인 너으르아	오 관을 사 오고 관이라 그러는 것은 널을 말해요 널을 가서 시장에 가서 뭐 뭐이 옛날에는 시장에서 사 온 것 이것을 보통 집에 놓고 했어요 널을
옌날버뜸 어르니 게시음마 너를 장만해 나써요	옛날부터 어른이 계시면 널을장만해 놓았어요
그걸 인제 대모글 불러 가주 그걸 은제 짜요	그것을 인제 대목을 불러 가지고 그것을 인제 짜요
너으럴 짜가주 인제 에 에끄 크래가주 인제 성복 찌내고 너를 짜 가주어느 이꽌할 땐능 글 인제 에 대르미라 캐요	널을 짜서 인제어 그래서 인제성복제 지내고 널을 짜 가지고는 입관할 때는 그것을 인제대렴이라고 해요
소리밀 때 소렴 대렴 한데 대려미라 그능 거느 인제 에 시시네다서렁을랑그이 옌날 마껀 수이라 그니더 웨 으이 주구꼬 어이 주거써 이 이꼬 가늠 오설 수이라 그능 게으 허게 주로 인제 베로 해요 명주로 하고	소렴일 때소렴 대렴 하는데 대렴이라고 그러는 것은 이제시신에설랑 그이 옛날 말로 수의라 그럽니다 왜죽고죽어서 입 입고 가는 옷을 수의라 그러는 게그게 주로 이제 베로 해요 명주로 하고
그글 은제 이페 가주고 그래 인제 머씨케고 그래가주 인제 국 과네 여가정 이꽈늘 하먼 이꽈늘 해가주 인제 하먼 그 상주드리 모도 옥 어허이 영위에 나와써우 고글 하고 그래그 난 디에는 그 인제 에 장이리 사밀짜이맘 머 그날 고마 배께 야깐 내나따가여 한 전느매 씨 시빌짜이나 치릴짜이나 오일짜이네데마 그으 급 과늘 바아 몬 나두그으요	그것을 인제 입혀 가지고 그래 인제 뭐아 씻기고 그래서 인제 그 관에 넣어 가지고 입관을 하면 입관을 해서 인제 하면그 상주들이 모두어 영위에 나와서 곡을 하고 그렇게 하고 난 뒤에는 그 인제어 장일이 삼일장이면 뭐 그날 그만 밖에 약간 내놓았다가 한 저 십 십일장이나 칠일장이나 오일장이나 되면 그 그 관을 방에 못 놔두거든요
웅 거 부패하기 때무레	어 그 부패하기 때문에
그래 배께 가따설랑 토롱이라꼬 해요	그래 바깥에 가져다설랑 토롱이라고해요
토롱이라 그능 거는 인제 근 너를 얻 배께서 땅알 이래 널 드갈 만찌음음 쪼끔 파고 고다 노코 이 영개라 그니드이	토롱이라고 그러는 것은 인제 그널을밖에 땅을 이래 널이 들어갈 만큼조금 파고 거기에 놓고 이 이엉이라그럽니다
