dialect	standard
한 뉵씹 포 가구 이서뜨 이서꼬	한 육십 호 가구 있었 있었고
야예예 사시 포는 타성이고	어예사십 호는 타성이고
그런데 여즈 음제 꺼꾸로 대애따 그지예	그런데 요즘 인제 거꾸로 되었다그렇지요
거 꺼꾸로 바께 덴 세미지요 머이	예 그 거꾸로 바뀌게 된 셈이지요 뭐
타성이 그아이 더 만타구 바에 지그믄뇨	타성이 그러니 더 많다고 봐요 지금은요
그다음메 혹씨 그 인제 성씨 구성으로 바서느 의성 김씨가 더 저거져꼬예 인제 타성바지가 더 마나져꼬 혹씨 무 풍습 까틍 거또 옌나레 비해서 요즘바낑 게 쫌 이씀미까	어 그다음에 혹시 그 인제 성씨 구성으로 봐서는 의성 김씨가 더 적어졌고인제 타성바지가 더 많아졌고 혹시 뭐 풍습 같은 것도 옛날에비해서 요즘 바뀐 게 좀 있습니까
풍스비 옌날 때음 마이 바께져따꼬 보제요	풍습이 옛날에 대면 많이 바뀌어졌다고 보지요
옌나레는 우리게이 머으 거러서 마알시더 이래 나선 장 거튼 데 시내 가암말시더 올리 이래 서게 나가다 봄 마제 미쩸 아놈 아무꺼시 장에 까세꼬 마리이 부르기도 하고 또 차자가서 궈뉴도 하고 이래 자아 가서 뭐 구경도 하고이래 이응 거러 댕기고 이게 일 때는 머 중간 중가이 그으 주 취 옌나릉 주마기라 그래앤데 거 술찌베 드아서 멈 모기 마름 머 마껄리도 한 잔시 사 머꼬 서로 일해 내려오게 해앤데 요샌느 그릉 거또 업써져 뻐레꼬 여어 불	옛날에는우리끼리 뭐 걸어서 말입니다 이래 나서서 시장 같은 데 시내 가면 말입니다 오늘이래 설설 나가다 보면 말이지 밑에 아무 아무개야 장에 가자고 말이지 부르기도하고 또 찾아가서 권유도 하고 이래 장에 가서 뭐 구경도 하고 이래 이래 걸어 가니고 이래 이럴 때는 뭐 중간 중간에 그 주 주 옛날에는 주막이라고 그랬는데 거기 술집에 들어가서 뭐 목이 마르면 뭐 막걸리도 한 잔씩 사 먹고 서로 이래 내려오고 했는데 요새는 그런 것도 없어져 버렸고 여기 불
이 즈 에 에 예저네 여 주마기 쫌 이써씀미까	어 이 저예 예전에 여기 주막이 좀 있었습니까
여 여 우쩨 뚬 마낸니데 여쭝 쭉 올러가머	예 여기 여기 윗쪽에 좀 많았어요 요쪽으로 쪽 올라가면
그래 그른 데 모에 가즈 참 정담도 나누고 핸데 요새느 차를 타고 다니이께네 요 우에 사는 사람 요 우에 사은 설 마카 차로 다니이께네여 그이 이 임정이랑 겓 떠 부래요	그래 그런 데 모여 가지고 참 정담도 나누고 했는데 요새는차를 타고 다니니까 요 위에 사는 사람 요 위에 사는 사람 모두 차로 다니니까 그이 인정이라는 게 떠 버려요
위으 사라미랑 거느 자주 솜 접초기 데고 마래요 얘기도 나누꼬 머 조은얘기도 하구 나쁜 얘기 따어 이 이래 모에야 정다미 나오고 즈 쯔 정이 가는  데 이러 머이 일 려느 한두 범 만내찌 말쩨 하이께네 이 정이 저거지구요	이사람이란 것은 자주 좀 접촉이 되고 말이에요 얘기도 나누고 뭐 좋은 얘기도 하고나쁜 얘기도 하고 이 이래 모여야 정담이 나오고 정 정 정이 가는데 이래 뭐 일년에 한두 번 만날지 말지 하니까 이 정이 적어지고요
그 밤며네 잉감미도오 점맘 모태요	그 반면에 인간미도 전만 못해요
고움믄 니는 네고 나는 나오 고마 그래 지내고 또 자주 모엘 기헤도 어꼬그래 데드러꼬	고만 너는 너고 나는 나고 고만 그래 지내고 또 자주 모일 기회도없고 그래 되더라고
그르기 그거는 옌날맘 모태이	그러니 그것은 옛날만 못해요
고어뜰 이야그 으느이 똑 드라끄 끄트머	그것들 이야기꼭 들라고 할 것 같으면
그 혹시 머 농사진능 거또 예저네하고 요즘 머 풍스비 쫌 달러져씀미까	그 혹시 뭐 농사짓는 것도 예전하고 요즘 뭐 풍습이 좀 달라졌습니까
아이 마이 달라져쪄이	아이고 많이 달라졌지요
옌나레는 이 점붑 포마실 핸니더	옛날에는 이 전부 품앗이를 했습니다
내가 에이 예엔 아이 입 이 지베 가서 모를 하러 에 저 지 시머 주 잔니껴	내가어이 이 집에 가서 모를 하루저 저 심어 주지 않습니까
또 저 부이 내 지베 와써 시머 주우 이릅 포 푸마씨로	또 저 분이 내 집에와서 심어 주고 이래 품 품앗이로
이읍 이 농사랑 게이 옌나른 소느로 모를 시므끼 때므네 사라미 한둘 카지암 므이 여나암씩 데이 데그더	이 이 농사라는 것이 옛날에는 손으로 모를 심었기 때문에 사람이 한둘 가지고는 안 되고 여남은씩 되어야 되거든
그래 그 이등 모도 푸멀 마아 가주 한동네 사느끼르노 머 이 가조 오느를 이지븜 머 시머 즈고 저 짐 모 시머 저고 그래 모도 농사을 지인는데 요새능 기게가 발딸데 가주우 기게가 조응 게 나와 가주 고망 개이니 이 지 지가 지 해해 뿌래 마카요	그래 이 이래 모두 품을 모아 가지고 한 동네 사람끼리니까 뭐이래 가지고 오늘 이 집 모 심어 주고 저 집 모 심어 주고 그래 모두 농사를 지었는데 요새는 기계가 발달돼 가지고 기계가 좋은 것이 나와 가지고 개인이 이 자기자기가 자기 것을 해 버려 모두가요
그르이 농사도 옌날고 인저 확씨리 달러져 뿌리멈 머 푸마씨하자 소리거 업써이	그러니 농사도 옛날과는 인제 확실히 달라져 버리면서 뭐 품앗이하자는 소리가 없어
기 기게로 해 뿌이께 인제 머 고마	기 기계로 해 버리니까 인제 뭐 고만
지 기게 가주우 또 마 오이 지 기게 엄는 사러므 나무 기게 하록 폼 주고사 가주 고마 기게루 시머 뿌이께 웨부 사럼 살 피루가 어꼬	자기 기계 가지고 또 뭐자기 기계 없는 사람은 남의 기계를 하루 품을 주고 사 가지고 고만기계로 심어 버리니까 외부 사람을 살 필요가 없고
그래 데 가즈으 그걸 바 가즈우도 농사 진능거또 옌날 가찌 이 이 정미가저거져요	그래 돼 가지고 그것을 봐 가지고도 농사짓는 것도 옛날 같지 이 이 인정미가 적어져요
인정미가 저거져 뿌래요	인정미가 적어져 버려요
그이 보믄서이 시스마끔 하이께네	그래 보면서 스스로 하니까
멍 모에 가주 머 얘기하주 시간도 어허꼬	뭐 모여 가지고 뭐 얘기할 시간도없고
허 그 그램 농사도 마이 변젹떼쩨욛 지금 머	허 그 그래 봉사도 많이 변질되었지요 지금 뭐
그암 어째뜬 예저네느 쪼곰 이 마으레 사는 사암드리 서로 인정을 마니 주고바던는데 요즘먼 그런 부분드리 머 영 적따 그지예	그러면 어쨌든 예전에는조금 이 마을에 사는 사람들이 서로 인정을 많이 주고받았는데 요즘은 그런 부분들이 뭐 영 적다 그렇지요
그르체요	그렇지요
적쩨에요 으녀 작 그이 사라미느이랑 건 자주 모에 가주 얘기를 대활 하고 이래 나츨 자주 보고 해야 정이 나능 게드더요	적지요인제 그 사람이라는 것은 자주 모여 가지고 얘기를 대화를 하고 이래 낯을 자주 보고 해야 정이 나는것이거든요
구 구 구 그게 머러지이께네 자연히 고마 정도 뜨고 또 그르 찌 접짝 수짜더 찌음 자 짱꼬 그래 데드라꼬요	그 그 그 그게 멀어지니까 자연히 고만 정도 뜨고 또 그래 접 접촉 숫자도 잦 잦지 않고 그래 되더라고요
검 그게 혹씨 머에저넫 귿웨부 사암드리 타성바지가 자꾸 마니 드러와서 그런 영향도 이씀미까 앙 그럼며넌 그그하옴 머 별 광게 업씨 인자 세워리 바껴 가주우 그러씀미까	그럼 그게 혹시 뭐예전에 그외부 사람들이 타성바지가 자꾸 많이 들어와서 그런 영향도 있습니까 안 그러면은 그것하고는뭐 별 관계 없이 이제 세월이 바뀌어 가지고 그렀습니까
그른 광게는 별로 업써요	그런 관계는 별로 없어요
머 타서이 드온다 그르 가주 머 거 정이 뜰리덩데음	뭐 타성이 들어온다고그래 가지고 뭐 그 정이 떨어지거나
타성 역씨도 그래요	타성도 역시 그래요
여 두와 가주 자기 농 자기 일 하고 여 똥어 이 시내 가서 버는 사러믄 고마 다 엗 자고 머 시내 가 뿌고	여기 들어와 가지고 자기 논 자기 일 하고 여기또 이 시내 가서 버는 사람은 고만 다자고 뭐 시내 가 버리고
그르히 또옹니 사럼하구 접초기 잘 안 데미	그러니 동네 사람하고 접촉이 잘안 되고
에이 그 그그른 경야이지 므 끄으 머 승 썽씨가 달리 와 가주우 그릉 건업써에	어 그 그런 경향이지 뭐 그 뭐 성 성씨가 달리 와 가지고 그런 것은없어요
그다으메지검까지는 주로 마으레 대해서 이야기를 해 주셔꼬그다으멘 어르신네 대해서 쪼꼼 함분 여쭈어 보  바오게씀니다	그 다음에지금까지는 주로 마을에 대해서 이야기를 해 주셨고그 다음에는 어르신에 대해서 좀한 번 여쭈어 보  보겠습니다
예 예예	예예예 예
어르신께섣 태어나서 지응까이 사러오오신 그런 내려게 대해서 쫌 이야길 해 주십씨오	어 어르신께서 태어나서 지금까지 살아오신 그런 내력에 내대서좀 이야기를 해 주십시오
혹시 태언 태어낭 고시나 그다은 나이나 띠나 이럼 부부네 대해서 함분이야길 해 주십씨여 어예	혹시 태어 태어난 곳이나 그 다음 나이나 띠나 이런부분에 대해서 한 번 이야기를 해 주십시오
글세유 그게 나는 머 능기 나이 시방 팔시비라도 여게 성장을 여어서 핸니더	글쎄요 그게 나이는 뭐 그러니까 나이가 시방 팔십이라도 여기에서 성장을여기에서 했습니다
여어가참 출생지가 여게고 또 내가 성장을 여어서 해꼬 또 이때끔음나이 팔시빋 데두룩 머어여이 또 여게를 벨러 떠나 본 녜가 어꼬 그래 사러와꼬	여기가참 출생지가 여기이고 또 내가 성장을 여기에서 했고 또 이때까지 나이 팔십이 되도록 뭐어 또 여기를 별로 떠나 본 예가 없고 그래 살아왔고
또 웅으 생화으랑 게 그리두 웨 우리게 내갇 떼어 여 머 태어나긴 태어나쓰나 하데 어릴 때 내마근 모르고 여게 머 저 쪼맨할 찌는 참 코럴 흘레고 쪼얻쪼차뎅길 찌느 서로 머 흘글 퍼부어거 장난도 하고 마래이 이릉 거또 씨름도 하고 무어 이른흥흥 이힉 경과도 이서꽁 그르고 또 머 그 옌다르능 고 궁민하꾜라그은능 그 그 쪼매 다닝 거또 머 여선 옌다레느 군새케 짠니껴 모두가	또 어생활이라는 게 그래도 왜 우리가 내가 태어 여기서 뭐 태어나기는 태어났어나 그렇기는 하되 어릴 때 내막은 모르고 여기에 뭐 저 조그마할 적에는 참 코를 흘리고 쫓아 쫓아다닐 적에는 서로 뭐 흙을 퍼부어서 장난도 하고 말이야 이런 것도 씨름도하고 뭐 이런 이 경과도 있었고 그리고 또 뭐 그 옛날에는 고 국민학교라고 그러는것 그 조금 다닌 것도 뭐 여기에서는 옛날에는 궁색했지 않습니까 모두가
머 식생활또 쫌 넝넉짱꼬 이식또 넝적짱코 그른 황경에서 그 뜨 이음 머 읻자라자 하이께네머 언 올케 먹또 모타고 어우 바른 성장도 모태따고바요	뭐 식생활도 넉넉지 않고 의식도 넉넉지 않고 그런 환경에서 그 또 이 뭐 이 자라자고 하니까뭐옳게 먹지도 못하고바른 성장도 못했다고 봐요
그이 웨이 지금드 글때가 요새거치 멍능 게데 참 식쌩화리 조아따므 키도 좀더 커스 께라고 바요	그 왜 지금도 그때가 요새 같이 먹는 것이 참 식생활이 좋았다면 키도 좀 더 컸을 것이라고 봐요
그르나 더 옌나레엔 그기 생화리 그마꿈	그러나 저 옛날에는 그게 생활이 그만큼
거럼 그럼므 어르신 그 태어나신 해가 면 년도심미까	그럼 그러면 어르신그 태어나신 해가 몇 년도이십니까
경오새이께네이 경오여니고 에 서기로느 청구백삼심녀니고 그러치 머에	경오  생이니까 경오년이고 에 서기로는 천구백삼십 년이고 그렇지 뭐요
청구백삼심 년도 경오생이고	예 천구백삼십 년도 경오생이고
으예이 경오새이고	예 경오생이고
여 그다음메 그럼며 귿그다으메 어르신 그암 태어나시기넏 여 바라메에서 태어나셔따 그지요	예그다음에 그러면 그그다음에어르신 그럼태어나시기는 여기 바라미에서 태어나셨다 그렇지요
바러미 바러미	예 바라미 바라미
항녀근 어떠게 데심미까	어 학력은 어떻게 되십니까
항녀근 게아 구 궁민하꾜 가차 유명함미다이	학력은 겨우 국 국민학교 갖춰합니다
그으 그르며는 지거븐 어뜨게 데심미까	그 그러면은 직업은 어떻게 되십니까
주로 농사어를 하셔씀미까	주로 농사를 하셨습니까
농사도 짇 지따가 또 요샌 나이 마느이 농사을 지일 수 인니끼 믄 노니덩	예 농사도 짓 짓다가 또 요새는 나이가 많으니 농사를 지을 수 있습니까 뭐놉니다
그 몸 몸 뭐 아아드리 이그 머거 이귿 떠 돈냐이덛 주고 하능 까주 머꼬 사니더	그 뭐 뭐 뭐 아이들이 이것 뭐냐 이것 돈 돈냥이나 주고 하는 것을 가지고 먹고 삽니다
예저네느 그아므 주로 머 하셔씀미까	예전에는 그러면 주로 뭐 하셨습니까
옌나레 농사지어찌 머요	옛날에 농사지었지 뭐요
그럼며너 여 어르신 그걷 형제늠 며 뿌니나 게셔씀미까	그러면은 여기 어르신 그것 형제는 몇 분이나 계셨습니까
형제는 남자는 으흐 은 머셔 명어겨이 형제뿐이래꼬그르이 오 남매지 융 남매래찌 우리가요	아 형제는 남자는어 뭐  형제뿐이었고 아그러니 오 남매지 육 남매였지 우리가요
융 남매래엔데 다 죽꼬 인지는 뚜 두리가 나마 인니대	육 남매였는데 다죽고 인제는 둘 둘이 남아 있습니다
내하코 누님 하나하우까구 나마 이꼬 너이는 주거꼬요 인제는	나하고 누님하나하고가 남아 있고 넷은 죽었고요 인제는
가므 어드게 어르싱께서 형제 거 융 남재 중에서 어드겝 메째 부니심미까	그러면 어떻게 어르신께서 형제 그 육 남매 중에서 어떻게 몇 째 분이십니까
세째 부니이 세째시더 내가	셋째 분이 셋째입니다 내가
세째고예	셋째고요
우로 누니미 두 부니고	위로 누님이 두 분이고
미트로는	밑으로는
미트로느 인제 남동새이 하나이고 여동새이 두리 이꼬 그랜니더	밑으로는인제 남동생이 하나 있고 여동생이 둘이 있고 그랬습니다
가아여 지그믄	그러면 지금은
그 융 남매래써요	그래 육 남매였어요
그암므 위에 누임 함 분 게시고 지금도 사러 게시고	그러면 위에 누님 한분 계시고 지금도 살아 계시고
예내고 그래찌요	예예 나고 그랬지요
나머지 뿌우 형제 분드른 다 자꼬를 하셔따 그지예	나머지 분 형제 분들은 다 작고를 하셨다 그렇지요
응거 다 더 떠여 으 읍쩌예 주꼬 그이더 모두	응 다 다 떠없어예 죽고 그랬습니다 모두
그 혹시 어르싱 그 부몬님 고향은 어데심미까	그 혹시 그 부모님 고향은 어디이십니까
부모 고향도 여게시더	부모님 고향도 여기입니다
그얌 부모 여 그엄므 어르신 그거 머 아까 이야기하셔씀다만 이퍙조 이래로 쭉	그럼 부모님 여기 그러면 어르신 그것 뭐 아까 이야기하셨습니다만 입향조이래로 쭉
사무 여 이씅께	사뭇 여기 있었으니까
여 사몯 조상드른 다 여 이따 그지예	여기서 사뭇 조상들은 다 여기에서있었다 그렇지요
야 야 야 여기서	예예여기서 예
에 여이서 다 거주하시고 그래 해따 그지예	어 여기서 다 거주하시고 그래했다 그렇지요
예예	예 예예 예
그러며너 아버님 어르신러이 아버님께서너 여기서 태어나셛께따 그지예	그러면은 아버님 어르신의 아버님께서는 여기서 태어나셨겠다 그렇지요
여기서 태어난데여	예 여기서 태어나셨지요
여기서 태어나셔꼬 그럼며너 어르신 어머님 고향은 어디심미까	여기서 태어나셨고 그러면은 어르신 어머님 고향은 어디이십니까
어머니 고향은 저 옌나레는거 인능 그 거 예엔 풍기 따이야 아이 저에 충청도 다냥이라 근 데 단양	어머니 고향은 저 옛날에는거기에 있는 그거기 옛 풍기 땅이야 아니 저충청도 단양이라고 그러는 데 단양
다냥군 대강며니라 근 데 거게에선	단양군 대강면이라고 그러는 데 거기에서
다냥이고	예 단양이고
예 웨각 웨가는 거게시더	음외가 외가는 거기입니다
웨가 거이 으 그럼 어머니께서 이리로 한 언제쯤 시지오셔씀미까	예외가가 거기그럼 어머니께서 이리로 한 언제쯤 시집오셨습니까
크르익게네	그러니까
므 하이뜬 오래드 오래 전 니미다 그지예	뭐 하여간 오래된 오래 전 일이다 그렇지요
오래데쩨요	오래됐지요
오래데쓰게 거 확씨리 몰씸 내가 야 자꾸 이자뿌려써용	오래됐으니까 그 확실히 모르겠습니다 내가자꾸 잊어버렸어요
혹씨 그어 어르신 귿 조부모 조부께서도 여기 태어나셔쓸 꺼고	혹시 그어르신 그 조부모 조부께서도 여기에서 태어나셨을 것이고
여겓씨더	예 여기입니다
게속  야이야조부모옫 조부모도 여 태어나여	예예조부모 조부모도 여기에서 태어나셨어요
그암며느 혹씨 어르신태어나셔슬 때 할머니미 게셔씀미까	그러면은 혹시 어르신태어나셨을 때 할머님이 계셨습니까
할머니 게선니더 네	예 할머니 계셨습니다 네
내가 궁민하꾜 이 이 일 항년 땐지 이팍할 때에 그 그해 도러가신는데	내가 국민학교 일 일 일 학년 때인지 입학할 때에 그 그해에 돌아가셨는데
가머 할머니느 어디	그러면 할머니는 어디
할머니인 다시리시더 요게 요 요게 보 여	할머니는 닭실마을이십니다 요기에 요기 요기에 보면 여기
아 여 여쭈이 다 다시레서 오션네에	아 요기 요쪽에 닭실 닭실마을에서 오셨네요
야예 권씨 권씨 거	예예 권씨 권씨 거기
아 권씨씨고예	예권씨시고요
끄다으메 그 어머님 머 가며늗 다냥 어느 성씨가 어트게 데심미까	그다음에 그 어머님 뭐 그러면은 단양 어느 성씨가 어떻게 되십니까
예 다냥	예단양
거게능 기 김녕 김가씨더	거기는 김 김영 김가이십니다
김녕	아 김영 김씨
예이 김녕 김씨로 쓰고 예이 김녕이고 거언뇨	예김영 김씨로 쓰고예 김영 김씨이고 거기는요
예예예예 김녕	예 김영 김씨
이 깅가요 예예예	이 김가요 예
그다으멥 어르신 그 부몬님들께서느 하신 니른 그암 주로 어떠 닐 하셔쓰미거 생어브로	그 다음에 어르신 그 부모님들께서는 하신 일은 그럼 주로 어떤 일을 하셨습니까 생업으로
글세 그 생어비라 그릉 건느 우리 이 찜 맹이 주로 농사지 머요	글쎄 그생업이라고 그러는 것은 우리 이 저 역시 주로 농사이지 뭐요
농사지꼬 머 그래 그래 머 거으 긍그이 사러와찌 머에	농사짓고 뭐 그래 그래 뭐 그 근근이 살아왔지 뭐요 예
거므 어르신 부몬님들도 여게서 은제 주로 생어브로 농사를 하셔짠	그러면어르신 부모님들도 여기에서 이제 주로 생업으로 농사를 하셨지요
예예 생어븐 농사지 그언 나니 농사지 머 이 주로	예 생업은 농사이지 그뭐 농사지 뭐 이 주로
머 이 옌나르 다릉 게 이서께씀미까	뭐 이 옛날에 다른 것이 있었겠습니까
그으다으메 어르신 그 인제 그 배우자께서는 푸 부이는 지곰 어느 지여게서태어나셔씀미까	그 다음에 어르신 그 인제 그 배우자께서는 부 부인은 지금 어느지역에서 태어나셨습니까
크 거게는 여 봉와군 추냥면 서배기라 그르는 데써요	그 거기는 여기 봉화군춘양면 서벽리라고 그러는 데요
이으 그어여 맹 추냥며니 그은넫 청주 정으으은씨에서 이 정가로 이 정가고요 네	이 그 역시 춘양면이 거기인데 청주 정씨에서 이 정가고 이 정가고요 네
가므 청주 정씨에서 봉화 추냥에서 태어나셔 가주고 거 어르신 인제 이리로바래미로 시지블 오션는데 주로 언제쯤 머 며 어르신 연세 메 싸레 거화초글 발거	그러면 청주 정씨에서 봉화 춘양에서 태어나셔 가지고 그 어르신 인제 이리로 해저리로 시집을 오셨는데 주로 언제쯤 뭐 몇 어르신 연세 몇 살에 그화촉을 밝혔습니까
그게 내개 시물일고베이 결홍을 해쓰이께네	그게 내가 스물일곱에 결혼을 했으니까
부인께서는 여 그때 연세가 어떠게 데에씀미까  거가 내보다 네 사리 쩌그 여 네 사리 저그이께네	거기가 나보다 네 살이 적으니네 살이 적으니까
스물세시다 그지에	스물셋이다 그렇지요
시물세시우 그르치 머여	어 스물셋이고 그렇지 뭐요
끄엄며너 그 그 봉화 추냥에 대애서는 쪼곰 함붕 거 아까어 부잉께섣 청주정씨라고 하셔찌예	그러면은 그 그 봉화 춘양에 대해서는 조금 한 번 그 아까부인께서 청주 정씨라고 하셨지요
예청주 엉가	예예 청주 정가
그암믄 그 그 그릉까 처가때기 데는데 거 처가땍 마으레 대애서 쫌 함무 이야기를 쫌 해 주이소	그러면 그 그 그러니까 처가댁이 되는데 거기 처가댁 마을에 대해서 좀 한 번 이야기를 좀 해 주십시오
거기가 요기서 한 오심 니 떠러진 녀 봉고군 추냥면 서변니라 근 덴데 그 금정광산 드가능 고 사인 동넨데 그 동네에는 맹 산중 똥네라	거기가 요기에서한 오십 리 떨어진 여기 봉화군 춘양면 서벽리라고 그러는 데인데 그 금정광산으로들어가는 그 사이의 동네인데 그 동네에는 역시 산중 동네야
산중 동넨데 이으 거어서으 그음 우리이 시꾸도 거어서 태어나고 거어서 성장해꼬 그래 가주 봉화 이리 해저르 출가흘 참 히 시지블 와꼬 나능 그리 장가을 가고 히케 핸는데 그 머 동네가 이 조아요	산중 동네인데 이 거기에서 그음 우리 식구도 거기에서 태어났고 거기에서 성장했고 그래 가지고 봉화이리 해저리로 출가를 참 이 시집을 왔고 나는 그리로 장가를 가고 이렇게 했는데그 머 동네가 이 좋아요
거 인심 조코또늠 머으 거으가머이 벨 흉푸이 엄뜨라꼬 거가보이껜 머 은데 전다븐 머 산중 비스탄 땅이라도 농사도 잘 떼고 머 생와릉 대다수거 깨 여그 여게보다 차라리 나아 짠나 그래 바따꼬 나는녀	거기 인심 좋고또는 뭐 거기가뭐이 별 흉풍이 없더라고 거기가 보니까 뭐 인제전답은 뭐 산중 비슷한 땅이라도 농사도 잘 되고 뭐 생활은 대다수가 꽤 여기 여기보다 차라리 낫지 않나 그래 봤다고 나는요
춘냥 쪼게도 그 너 받츤걷 그쪼에드 땅은 쫌 널븜 펴닝 거 가씁띠다 추냥	춘양 쪽에도 그 뭐 밭은 머 거기 그쪽에도 땅은 좀 넓은 편인 것 같더라고요 춘양
예예아 예예 거가산전뚠 전지라도귿 땅이 갠차너요	예거기가예 산전 전지라도그 땅이 괜찮아요
거 그르구 살기가 모도 갠창코 거어난 또 그래 그 머 집성초니 아이고 그른 동네는	그 그리고 살기가 모두 괜찮고 거기는 또 그래 그 뭐 집성촌이 아니고그런 동네는
이스 점브가 머 각썽이 모도가 머 모에 사는 동네고 으흐 그르습띠다	이 전부가 뭐 각성이 모두가 뭐 모여 사는 동네고그렇더라고요
어게 장개을 가 보이께네	거기에 장가를 가 보니까
그러며넏 어르신 그거 머 그 배우 부이는 그암 어떠켑 만나서 결혼해씀미까	그러면은 어르신 그것 뭐 그 배우자 부인은 그럼 어떻게 만나서 결혼했습니까
옌날른 그게 인제 이 중매결혼이래찌 머요	옛날에는 그게 인제 이 중매결혼이었지 뭐요
저기 중매결혼이래앤데 그래 웨 내가 그 당시 파 바 가주우는 이 그 글때는쪼꿈 내가엳 장가가 느즌 세미라요	저기 중매결혼이었는데 그래 왜 내가 그 당시 봐 봐 가지고는 이 그 그때는 조금 내가 장가가 늦은 셈이에요
